date,article_id,source,url,currency,title,snippet
2026-02-27,74a01b43ef7e,NewsAPI (The Times of India),https://economictimes.indiatimes.com/wealth/save/yes-bank-forex-card-users-alert-unauthorised-transactions-detected-cards-blocked-reissued/articleshow/128804606.cms,AUD,"YES Bank forex card users alert! Unauthorised transactions detected, cards blocked & reissued",YES Bank faced a cyberattack on its forex cards. Scammers attempted unauthorized transactions from a Latin American country. The bank's fraud monitoring system blocked many attempts. The Reserve Bank of India has summoned YES Bank officials. Affected clients …
2026-02-27,c461d6f066d4,NewsAPI (The Times of India),https://economictimes.indiatimes.com/industry/banking/finance/banking/yes-bank-tightens-safeguards-after-spike-in-forex-card-transaction-declines/articleshow/128801679.cms,AUD,Yes Bank tightens safeguards after spike in Forex Card transaction declines,Yes Bank has tightened security measures after detecting unusual transaction declines on its Multi-Currency Prepaid Forex Card issued with BookMyForex. Fraudulent attempts occurred at 15 Latin American merchants where two-factor authentication is not mandator…
2026-02-27,9c2ea309bd1e,NewsAPI (BusinessLine),https://www.thehindubusinessline.com/markets/why-shares-of-reliance-yes-bank-rvnl-texmaco-reliance-infra-and-lupin-will-remain-in-focus-on-thursday/article70678064.ece,AUD,"Why shares of Reliance, Yes Bank, RVNL, Texmaco, Reliance Infra and Lupin will remain in focus on Thursday","Shares of Reliance Industries, Yes Bank, RVNL, Texmaco, Reliance Infrastructure, Lupin and other top companies are in focus as major corporate updates, strategic investments, fraud disclosures, infrastructure orders, and pharma approvals drive market attentio…"
2026-02-27,92df5895ae6e,NewsAPI (GlobeNewswire),https://www.globenewswire.com/news-release/2026/02/26/3246201/0/en/Hepsiburada-Announces-Fourth-Quarter-and-Full-Year-2025-Financial-Results.html,AUD,Hepsiburada Announces Fourth Quarter and Full Year 2025 Financial Results,"ISTANBUL, Türkiye, Feb. 27, 2026 (GLOBE NEWSWIRE) -- D-MARKET Electronic Services & Trading (d/b/a “Hepsiburada”) (NASDAQ: HEPS), a leading Turkish e-commerce platform (referred to herein as “Hepsiburada” or the “Company”), today announces its unaudited finan…"
2026-02-27,4a6413e5f4d8,NewsAPI (Financial Post),https://financialpost.com/pmn/business-wire-news-releases-pmn/ritchie-bros-sells-us265-million-in-orlando-and-delivers-unmatched-scale-at-industrys-largest-auction,AUD,Ritchie Bros. Sells US$265+ Million in Orlando and Delivers Unmatched Scale at Industry’s Largest Auction,"14,500+ assets sold as global event signals strong start to 2026 equipment market ORLANDO, Fla. & WESTCHESTER, Ill. — RB Global, Inc. (NYSE: RBA) (TSX: RBA), a trusted global marketplace for insights, services and transaction solutions for commercial assets a…"
2026-02-27,b8896b83f4fb,NewsAPI (Whatjapanthinks.com),https://whatjapanthinks.com/turbo-dexair-ark-review/,AUD,Turbo Dexair Ark Review: Trusted Trading System or Fraud? Results Exposed,Turbo Dexair Ark stands out as a recently introduced digital asset trading solution designed to make easier and upgrade the overall user experience for individuals interested in digital asset investors. The platform suggests that it uses modern systems such a…
2026-02-28,4b6bdd61e6bd,NewsAPI (Cointelegraph),https://cointelegraph.com/news/yen-stablecoins-japan-crypto-ambitions,JPY,Why yen stablecoins are key to Japan’s crypto ambitions,"Japan’s regulators and conglomerates are working to bring one of the world’s key funding currencies into DeFi, but retail activity remains muted."
2026-02-28,045f6b8247d9,NewsAPI (GlobeNewswire),https://www.globenewswire.com/news-release/2026/02/27/3246346/28124/en/Canada-Prepaid-Card-and-Digital-Wallet-Intelligence-Report-2026-2030-26-26-Billion-Market-Intensifies-as-Bank-Led-Digital-Propositions-and-Embedded-Infrastructure-Entrants-Expand-C.html,CAD,Canada Prepaid Card and Digital Wallet Intelligence Report 2026-2030: $26.26 Billion Market Intensifies as Bank-Led Digital Propositions and Embedded Infrastructure Entrants Expand Competition,"The Canadian prepaid card and digital wallet market offers opportunities in expanding reloadable prepaid cards for everyday spending, enhancing embedded finance for B2B disbursements, and strengthening compliance and disclosure standards. With digital trends …"
2026-02-28,2522c3abcb74,NewsAPI (Financial Post),https://financialpost.com/pmn/business-pmn/gold-rises-on-chinese-trading-with-us-iran-tensions-in-focus,CNY,Gold Rises on Chinese Trading With US-Iran Tensions in Focus,"Gold and silver rose as the Shanghai Futures Exchange’s night session began, with a US military build-up in the Middle East keeping markets on edge."
2026-02-28,63ef00de34b8,FXStreet,https://www.fxstreet.com/news/breaking-us-and-israel-attack-iran-risk-aversion-to-sweep-global-markets-202602280856,USD,"Breaking: US and Israel attack Iran, risk aversion to sweep global markets","Early Saturday, United States (US) President Donald Trump announced that the US had begun “major combat operations” in Iran, following Israel’s pre-emptive missile attacks against Tehran."
2026-02-28,662001bdd615,Yahoo Finance,https://finance.yahoo.com/news/dollar-tree-inc-dltr-bull-195704629.html,USD,"Dollar Tree, Inc. (DLTR): A Bull Case Theory",
2026-02-28,d7af00fbeee3,NewsAPI (BusinessLine),https://www.thehindubusinessline.com/markets/forex/rupee-falls-8-paise-to-settle-at-9099-against-us-dollar/article70683777.ece,USD,Rupee falls 8 paise to settle at 90.99 against US dollar,The rupee declined 8 paise to settle at 90.99 (provisional) against the US dollar on Friday weighed down by a sharp rise in global crude oil prices amid geopolitical uncertainties.
2026-02-28,566f0eea625c,NewsAPI (Financial Post),https://financialpost.com/globe-newswire/fairfax-completes-c650-million-senior-notes-offering,USD,Fairfax Completes C$650 Million Senior Notes Offering,"Not for distribution to U.S. news wire services or dissemination in the United States. TORONTO, Feb. 27, 2026 (GLOBE NEWSWIRE) — Fairfax Financial Holdings Limited (“Fairfax”) (TSX: FFH and FFH.U) has completed its previously announced offering (the “Offering…"
2026-02-28,cc6878ed8f35,NewsAPI (GlobeNewswire),https://www.globenewswire.com/news-release/2026/02/27/3246501/0/en/Fairfax-Completes-C-650-Million-Senior-Notes-Offering.html,USD,Fairfax Completes C$650 Million Senior Notes Offering,"Not for distribution to U.S. news wire services or dissemination in the United States. TORONTO, Feb. 27, 2026 (GLOBE NEWSWIRE) -- Fairfax Financial..."
2026-02-28,aa6ffb91873e,NewsAPI (GlobeNewswire),https://www.globenewswire.com/news-release/2026/02/27/3246413/0/en/Endeavour-Silver-Announces-Q4-2025-Financial-Results-Earnings-Call-at-10AM-PST-1PM-EST-Today.html,USD,Endeavour Silver Announces Q4 2025 Financial Results; Earnings Call at 10AM PST (1PM EST) Today,"VANCOUVER, British Columbia, Feb. 27, 2026 (GLOBE NEWSWIRE) -- Endeavour Silver Corp. (“Endeavour” or the “Company”) (NYSE: EXK; TSX: EDR) announces its financial and operating results for the three months and year ended December 31, 2025. All dollar amounts …"
2026-02-28,4a0de3fbf08a,NewsAPI (Github.com),https://github.com/paolobietolini/caddy-x402,USD,Show HN: Caddy plugin that charges AI crawlers real USDC to access your site,"Hello, I built a Caddy middleware that implements the x402 protocol (by Coinbase) to charge AI crawlers real money for content access.When GPTBot, ClaudeBot, or any known AI crawler hits your site, it gets an HTTP 402 with payment requirements. If it pays (U…"
2026-02-28,ac6b4db740bf,NewsAPI (GlobeNewswire),https://www.globenewswire.com/news-release/2026/02/27/3246377/28124/en/Sweden-Prepaid-Card-and-Digital-Wallet-Intelligence-Databook-Report-2026-A-9-96-Billion-Market-by-2030-Market-Dynamics-Size-and-Forecast-and-Share-Statistics-2021-2030.html,SEK,"Sweden Prepaid Card and Digital Wallet Intelligence Databook Report 2026: A $9.96 Billion Market by 2030 - Market Dynamics, Size and Forecast, and Share Statistics 2021-2030","Sweden's prepaid card and digital wallet market shows growth opportunities in varied sectors such as retail, travel, gaming, and government programs, with significant consumer trends across demographics. Key growth drivers include diverse card types, digital …"
2026-02-28,b6bdc5bf0938,NewsAPI (Financial Post),https://financialpost.com/globe-newswire/ipsen-receives-positive-chmp-opinion-for-ojemda-for-the-treatment-as-monotherapy-of-children-with-relapsed-or-refractory-braf-altered-pediatric-low-grade-glioma,EUR,Ipsen receives positive CHMP opinion for Ojemda® for the treatment as monotherapy of children with relapsed or refractory BRAF-altered pediatric low-grade glioma,"If approved, Ojemda® (tovorafenib) is expected to be the first and only targeted medicine in European Union for children with relapsed or refractory BRAF-altered pediatric low-grade glioma, irrespective of the type of BRAF alterationi The decision is based on…"
2026-02-28,835272c1c186,NewsAPI (GlobeNewswire),https://www.globenewswire.com/news-release/2026/02/27/3246394/0/en/Ipsen-receives-positive-CHMP-opinion-for-Ojemda-for-the-treatment-as-monotherapy-of-children-with-relapsed-or-refractory-BRAF-altered-pediatric-low-grade-glioma.html,EUR,Ipsen receives positive CHMP opinion for Ojemda® for the treatment as monotherapy of children with relapsed or refractory BRAF-altered pediatric low-grade glioma,"PARIS, FRANCE, 27 FEBRUARY 2026 - Ipsen (Euronext: IPN; ADR: IPSEY) announced today that the Committee for Medicinal Products for Human Use (CHMP) of the European Medicines Agency (EMA) has issued a positive opinion recommending the conditional marketing auth…"
2026-02-28,9c390435cadd,Yahoo Finance,https://finance.yahoo.com/news/est-e-lauder-companies-inc-194903189.html,AUD,The Estée Lauder Companies Inc. (EL): A Bull Case Theory,
2026-02-28,5baf5b08e7e5,NewsAPI (GlobeNewswire),https://www.globenewswire.com/news-release/2026/02/27/3246397/28124/en/Saudi-Arabia-Prepaid-Card-and-Digital-Wallet-Market-Intelligence-Report-2026-stc-bank-and-Urpay-Intensify-Competition-Through-Apple-Pay-Mada-Integration-and-Card-Linked-Stored-Valu.html,AUD,Saudi Arabia Prepaid Card and Digital Wallet Market Intelligence Report 2026: stc bank and Urpay Intensify Competition Through Apple Pay/Mada Integration and Card-Linked Stored-Value Strategies,"Key opportunities in Saudi Arabia's prepaid card and digital wallet market include enhancing wallet-native features for Mada acceptance and e-commerce integration, leveraging national e-payment infrastructure for seamless cross-border transactions, focusing o…"
2026-02-28,bdeb95b1494a,NewsAPI (GlobeNewswire),https://www.globenewswire.com/news-release/2026/02/27/3246365/28124/en/United-Kingdom-Prepaid-Card-and-Digital-Wallet-Intelligence-Report-2026-An-82-73-Billion-Market-by-2030-Primed-for-Growth-Due-to-Increased-Contactless-Adoption-and-Digital-first-Fi.html,AUD,"United Kingdom Prepaid Card and Digital Wallet Intelligence Report 2026: An $82.73 Billion Market by 2030, Primed for Growth Due to Increased Contactless Adoption and Digital-first Financial Solutions","The UK prepaid card and digital wallet market is primed for growth due to increased contactless adoption and digital-first financial solutions. Key opportunities include enhancing fraud controls with evolving FCA regulations, scaling prepaid solutions for und…"
2026-02-28,8d63d4fb43a6,NewsAPI (The Punch),https://punchng.com/beyond-the-scaffolding-years-of-pain-patience-and-the-audacity-that-built-banana-islands-tallest-tower-lucrezia-by-sujimoto/,AUD,"BEYOND THE SCAFFOLDING: Years of Pain, Patience, And The Audacity That Built Banana Island’s Tallest Tower Lucrezia By Sujimoto","Discover the story behind Lucrezia Banana Island, the tallest tower built by Sujimoto. A testament to endurance, luxury, and setting a new standard. Read More: https://punchng.com/beyond-the-scaffolding-years-of-pain-patience-and-the-audacity-that-built-bana…"
2026-03-01,ce9cc3579888,NewsAPI (The Times of India),https://economictimes.indiatimes.com/markets/stocks/news/new-era-of-trade-volatility-what-the-courts-decision-and-trumps-tariff-pivot-mean-for-commodities/articleshow/128875195.cms,USD,New era of trade volatility: What the court’s decision and Trump’s tariff pivot mean for commodities,"The U.S. Supreme Court blocked Donald Trump’s sweeping tariffs under IEEPA, but his swift 15% global levy revived uncertainty. The ruling jolted global trade dynamics, pressured the dollar, lifted gold and silver, and heightened volatility across energy and b…"
2026-03-01,d1bae9ca701e,NewsAPI (The Times of India),https://economictimes.indiatimes.com/markets/forex/us-dollar-heads-for-first-monthly-gain-since-october/articleshow/128874916.cms,USD,US dollar heads for first monthly gain since October,"The U.S. dollar is poised for its first monthly gain since October, despite a midday retreat from earlier highs. Hotter-than-expected producer price data initially boosted the greenback, but traders squared positions ahead of month-end and the weekend. Geopol…"
2026-03-01,92a3e8050a74,Yahoo Finance,https://finance.yahoo.com/news/enlight-renewable-enlt-reports-record-035751706.html,EUR,"Enlight Renewable (ENLT) Reports Record Q4 and Full-Year 2025 Results, Market Share Expands in European Storage Sector",
2026-03-01,d250492ae129,NewsAPI (Khabarhub.com),https://english.khabarhub.com/2026/28/536950/,EUR,Foreign currency exchange rates fixed for today,"KATHMANDU: Nepal Rastra Bank (NRB) has set the foreign currency exchange rates for today. According to the central bank, the buying rate of one US dollar stands at Rs 145.27, while the selling rate is Rs 145.87. The buying rate of one euro is Rs 171.47 and th…"
2026-03-01,af507ba3f3ca,Yahoo Finance,https://finance.yahoo.com/news/keurig-dr-pepper-kdp-gets-043739403.html,EUR,Keurig Dr Pepper (KDP) Gets Price Target Increase to $32 from Barclays,
2026-03-01,cc2139cf23f3,NewsAPI (GlobeNewswire),https://www.globenewswire.com/news-release/2026/02/27/3246821/0/en/AS-Silvano-Fashion-Group-Consolidated-Interim-Financial-Report-for-Q4-and-12m-of-2025-unaudited.html,AUD,AS Silvano Fashion Group Consolidated Interim Financial Report for Q4 and 12m of 2025 (unaudited),Selected Financial Indicators Summarized selected financial indicators of the Group for 12 months of 2025 compared to 12 months of 2024 and 31.12.2025...
2026-03-02,9afa8367cd92,FXStreet,https://www.fxstreet.com/news/gbp-jpy-price-forecast-bullish-engulfing-pattern-puts-21100-in-play-202603022023,GBP,GBP/JPY Price Forecast: Bullish engulfing pattern puts 211.00 in play,"GBP/JPY rises during the North American session on Monday, up by 0.24% after recovering from hitting daily lows of 209.10 amid risk aversion spurred by the Middle East conflict between the US and Iran. At the time of writing, the cross-pair trades at 210.98, about to overcome the 211.00 hurdle."
2026-03-02,4615505d9a10,FXStreet,https://www.fxstreet.com/news/gbp-politics-drag-but-macro-supports-ocbc-202603021503,GBP,GBP: Politics drag but macro supports – OCBC,"OCBC strategists Sim Moh Siong and Christopher Wong note that UK political risks, including Labour’s by‑election defeat and potential leadership challenge, continue to weigh on Pound sentiment."
2026-03-02,fd5965c99729,FXStreet,https://www.fxstreet.com/news/gbp-jpy-price-forecast-technical-structure-turns-constructive-above-21000-202603021310,GBP,GBP/JPY Price Forecast: Technical structure turns constructive above 210.00,"GBP/JPY rebounds sharply on Monday after a bearish gap-down open, as heightened volatility sweeps across the FX market following joint US-Israeli strikes on Iran over the weekend."
2026-03-02,833e1d7ba879,NewsAPI (Newsonjapan.com),https://newsonjapan.com/article/148511.php,JPY,Yen’s Purchasing Power Falls to One-Third Over 30 Years,"As price hikes spread from fast food to daily necessities and households grapple with rising living costs, the steady depreciation of the yen has emerged as a central driver of inflation, with multiple indicators showing that the currency’s purchasing power h…"
2026-03-02,9b039214e34d,ForexLive,https://investinglive.com/news/qatarenergy-halts-lng-production-after-military-attacks-on-its-facilities-20260302/,CAD,QatarEnergy halts LNG production after military attacks on its facilities,"Things are just getting messier by the hour. QatarEnergy is the state-owned integrated energy company of Qatar. And they have just announced a stop to its LNG production and associated products. That follows attacks on its operating facilities in Ras Laffan Industrial City and Mesaieed Industrial City.For some context, Qatar ranks as among the top three LNG exporters in the world and controls roughly one-quarter of the projected global LNG supply for the next decade.Their Ras Laffan facility in "
2026-03-02,9948c79c8819,Yahoo Finance,https://finance.yahoo.com/news/borderlands-mexico-canada-mexico-draw-120000636.html,CAD,"Borderlands Mexico: Canada, Mexico draw record foreign investment in 2025",
2026-03-02,5da92591262e,Yahoo Finance,https://finance.yahoo.com/news/3-reasons-buy-mercadolibre-stock-113500499.html,CAD,3 Reasons to Buy MercadoLibre Stock Like There's No Tomorrow,
2026-03-02,eae722e595ae,ForexLive,https://investinglive.com/news/france-february-final-manufacturing-pmi-501-vs-499-prelim-20260302/,CHF,France February final manufacturing PMI 50.1 vs 49.9 prelim,"Prior 51.2The final estimate is a slight nudge up to the initial reading, so it at least sees back-to-back months of increase in French manufacturing activity at the start of 2026. That being said, the February reading is rather marginal as production expanded in the absence of new order growth. On the price front, inflationary pressures picked up across France's manufacturing sector as higher prices for metals and metal products drove a quicker rise in input costs.HCOB notes that:""The French ma"
2026-03-02,9fe532831adc,ForexLive,https://investinglive.com/news/switzerland-february-manufacturing-pmi-474-vs-500-expected-20260302/,CHF,Switzerland February manufacturing PMI 47.4 vs 50.0 expected,"Prior 48.8Hopes for a recovery in the Swiss industry were dashed with this being another contractionary reading in February. This marks a 38th straight month that Switzerland's manufacturing sector recorded below the 50-point growth threshold. Of note, production slumped back lower with new orders also softening once again. The details:It reaffirms that the environment for the Swiss industry remains challenging. The only positive is that the Swiss economy relies much more on the services sector."
2026-03-02,fafd25f00968,FXStreet,https://www.fxstreet.com/news/us-trumpism-energy-leverage-and-china-rabobank-202603021407,CNY,"US: Trumpism, energy leverage and China – Rabobank","Rabobank links the Iran strikes to a broader US ‘Grand Macro Strategy’ under Trumpism, aimed at controlling key raw materials and energy flows that China relies on."
2026-03-02,3d2c9282e908,NewsAPI (The Times of India),https://economictimes.indiatimes.com/news/international/us/why-are-gold-and-silver-prices-increasing-now-and-will-gold-touch-6000-and-silver-200-soon-precious-metals-rise-current-prices-analysts-insights-and-market-outlook-explained-heres-what-should-investors-do-now/articleshow/128883276.cms,CNY,"Why are gold and silver prices increasing now, and will gold touch $6,000 and silver $200 soon? Precious metals rise, current prices, analysts insights and market outlook explained. Here's what should investors do now","Gold and silver prices are rising as tensions between Israel and Iran escalate. Analysts see safe-haven demand driving metals higher. Gold nears $5,300, silver approaches $93. Experts expect further gains if conflict escalates. U.S. inflation data and Chinese…"
2026-03-02,8e60df0993ea,ForexLive,https://investinglive.com/news/investinglive-asia-pacific-market-news-wrap-oil-up-5-with-eyes-on-iran-20260302/,USD,investingLive Asia-Pacific market news wrap: Oil up 5% with eyes on Iran,"BOJ's Himino: GDP is tracking okayTrump floats lifting sanctions against a new Iranian regimeBolton warns Trump may not have thought past the trigger on IranOPEC+ hiked oil production by 206,000 bpd in Sunday's meetingTrump: We have hit hundreds of targetsMarkets:WTI crude oil up $3.74 to $5.6%US 10-year yields up 1.7 bps to 3.98%Gold up $80 to $5355S&P 500 futures down 0.7%USD leads, GBP lagsThe whole market was holding its breath as oil futures opened to start the week and the initial price ac"
2026-03-02,d4fda5db0360,ForexLive,https://investinglive.com/news/a-look-at-markets-as-the-opening-dust-settles-20260302/,USD,A look at markets as the opening dust settles,"By now, everyone knows what's happening as the US and Israel strike Iran. Here is the state of play one hour into futures trading:WTI crude up $5.37 to $72.40 (about 8%)Gold up 2% to $5385The US dollar leads in FX, narrowly ahead of CHFAUD/USD is the biggest mover, down 60 pips (or 0.82%) to 0.7054Nikkei 225 opens down 1.5%Bitcoin flat near $66KThe latest war headline: Israeli military says it continues to carry out large-scale strikes against targets across Tehran.I'm somewhat surprised that US"
2026-03-02,09aa3ed4f286,FXStreet,https://www.fxstreet.com/news/forex-today-us-dollar-surges-above-9850-as-us-israel-strikes-on-iran-spark-geopolitical-crisis-202603022009,USD,Forex Today: US Dollar surges above 98.50 as US-Israel strikes on Iran spark geopolitical crisis,"The United States, allied with Israel, struck Iran over the weekend, killing Iran’s Supreme Leader, Ayatollah Ali Khamenei."
2026-03-02,90695119358a,FXStreet,https://www.fxstreet.com/news/aud-usd-drops-on-iran-conflict-rhetoric-and-firm-us-data-202603021932,USD,AUD/USD drops on Iran conflict rhetoric and firm US data,"The Australian Dollar (AUD) registers losses versus the Greenback on Monday following over-the-weekend developments in the Middle East, which triggered a flight to safety, weighing on the AUD/USD pair. At the time of writing, it trades at 0.7083, down 0.37%."
2026-03-02,57f3aaaa464e,FXStreet,https://www.fxstreet.com/news/nzd-usd-weakens-as-risk-off-sentiment-lifts-the-us-dollar-202603021822,USD,NZD/USD weakens as risk-off sentiment lifts the US Dollar,NZD/USD trades under pressure on Monday as the New Zealand Dollar (NZD) weakens against the US Dollar (USD) amid escalating geopolitical tensions in the Middle East.
2026-03-02,0e53d645b179,FXStreet,https://www.fxstreet.com/news/us-dollar-index-surges-to-five-week-highs-as-middle-east-conflict-drives-safe-haven-demand-202603021808,USD,US Dollar Index surges to five-week highs as Middle East conflict drives safe-haven demand,"The US Dollar Index (DXY) jumped about 0.85% on Monday, surging through the 98.00 level to touch a session high around 98.75, its strongest reading in five weeks."
2026-03-02,dbcb071082e8,FXStreet,https://www.fxstreet.com/news/cee-fx-forint-and-lira-seen-under-pressure-ing-202603021754,USD,CEE FX: Forint and Lira seen under pressure – ING,ING’s Frantisek Taborsky warns CEE currencies face downside as the Iran-related energy shock hits an import-dependent region. Higher Oil and gas prices and a stronger Dollar are expected to weigh on CEE FX and delay rate-cut plans.
2026-03-02,cf5d0f61d189,FXStreet,https://www.fxstreet.com/news/gold-rallies-towards-5-300-as-mideast-war-oil-spike-stoke-haven-bid-202603021725,USD,"Gold rallies towards $5,300 as Mideast war, Oil spike stoke haven bid","Gold prices advance over 1% on Monday, as geopolitical risks rise due to the escalation of the conflict in the Middle East that sparked an attack from the US and Israel on Iran. At the time of writing, XAU/USD trades at $5,341 after hitting a one-month high of $5,419 earlier in the day."
2026-03-02,40abd539202b,FXStreet,https://www.fxstreet.com/news/silver-price-forecast-xag-usd-rises-above-95-amid-middle-east-war-202603021025,USD,Silver Price Forecast: XAG/USD tumbles below $90 as US Dollar surges,"Silver (XAG/USD) drops toward $87.90 at the time of writing on Monday, losing 6.33% on the day and sharply reversing the gains recorded earlier in the day."
2026-03-02,a48387abd486,FXStreet,https://www.fxstreet.com/news/gold-surges-on-safe-haven-flows-amid-us-iran-war-202603021215,USD,Gold eases after US-Israel strikes on Iran rattle global markets,"Gold (XAU/USD) eases after opening the week with a bullish gap amid escalating geopolitical tensions in the Middle East, with the US-Iran war triggering a fresh wave of safe-haven demand."
2026-03-02,b5b8f1086fac,FXStreet,https://www.fxstreet.com/news/usd-chf-advances-on-middle-east-war-robust-us-manufacturing-pmi-202603021620,USD,"USD/CHF advances on Middle East war, robust US manufacturing PMI","USD/CHF trades around 0.7800 on Monday at the time of writing, up 1.50% on the day, as the US Dollar (USD) extends gains that were already in place before the release of US manufacturing data."
2026-03-02,ad23f01d08ba,FXStreet,https://www.fxstreet.com/news/usd-cad-climbs-as-us-iran-war-drives-safe-haven-demand-oil-prices-jump-202603021511,USD,"USD/CAD climbs as US-Iran war drives safe-haven demand, Oil prices jump","The Canadian Dollar (CAD) trades on the back foot against the US Dollar (USD) on Monday as the US-Iran war sparks a risk-off mood in global markets, boosting demand for the safe-haven Greenback and weighing on risk-sensitive currencies."
