date,article_id,source,url,currency,title,snippet
2026-02-24,bf0c0ab30801,FXStreet,https://www.fxstreet.com/news/boes-pill-bearing-down-on-inflationary-pressures-remains-necessary-202602241706,GBP,BoE’s Pill: Bearing down on inflationary pressures remains necessary,"Bank of England (BoE) Chief Economist Huw Pill said that the BoE has put too much weight on inflation being near the target rather than looking ahead, in remarks at the parliament's Treasury Committee on Tuesday."
2026-02-24,639474d8fdb4,FXStreet,https://www.fxstreet.com/news/boes-governor-bailey-rate-cut-at-next-meeting-is-a-genuinely-open-question-202602241705,GBP,BoE’s Governor Bailey: Rate cut at next meeting is a genuinely open question,"Bank of England (BoE) Governor Andrew Bailey said on Tuesday that he expects inflation to return to close to target in April. During his testimony before the parliament's Treasury committee, he added that a possible rate cut in March is ""a genuinely open question."""
2026-02-24,69e0c9e63be9,FXStreet,https://www.fxstreet.com/news/bank-of-england-cuts-on-the-table-conviction-still-building-202602241538,GBP,"Bank of England: Cuts on the table, conviction still building","At the Treasury Select Committee (TSC) hearing following the February Monetary Policy Report, Bank of England (BoE) Governor Andrew Bailey struck a cautiously dovish tone, suggesting that with inflation returning to target, there should be scope for further monetary policy easing."
2026-02-24,fefd92113b1f,FXStreet,https://www.fxstreet.com/news/gbp-jpy-climbs-above-two-week-range-as-yen-weakens-bailey-testimony-eyed-202602241413,GBP,"GBP/JPY climbs above two-week range as Yen weakens, Bailey testimony eyed",The British Pound (GBP) strengthens against the Japanese Yen (JPY) on Tuesday as the Yen weakens broadly after reports that Japan’s Prime Minister Sanae Takaichi raised concerns about further interest rate hikes in a meeting with Bank of Japan (BoJ) Governor Kazuo Ueda last week.
2026-02-24,55855e9585f9,NewsAPI (The Times of India),https://timesofindia.indiatimes.com/india/political-messaging-behind-timing-of-installation-of-rajajis-bust/articleshow/128727022.cms,JPY,Political messaging behind timing of installation of Rajaji’s bust?,India News: NEW DELHI: The timing of installation of C Rajagopalachari's bust replacing Edward Lutyens at Rashtrapati Bhawan gains significance as the southern st.
2026-02-24,f6f5384c1e2d,FXStreet,https://www.fxstreet.com/news/cny-pboc-on-hold-as-yuan-firms-bny-202602241907,CAD,CNY: PBoC on hold as Yuan firms – BNY,"BNY’s Head of Markets Macro Strategy Bob Savage notes that the People’s Bank of China kept its 1-year and 5-year LPR unchanged at 3% and 3.5%, balancing growth support and currency stability. Despite weak GDP and persistent deflationary pressures, authorities are focusing on services consumption."
2026-02-24,18ccf0916148,Yahoo Finance,https://finance.yahoo.com/news/want-1-million-retirement-invest-133100586.html,CAD,"Want $1 Million in Retirement? Invest $100,000 in These 3 Stocks and Wait a Decade.",
2026-02-24,c22d62932047,FXStreet,https://www.fxstreet.com/news/france-growth-outlook-softens-on-weaker-business-climate-ing-202602241528,CHF,France: Growth outlook softens on weaker business climate – ING,"ING economist Charlotte de Montpellier notes that French business confidence fell further in February, with the overall climate below its long‑term average and services particularly weak."
2026-02-24,eee3b3eaf7ea,ForexLive,https://investinglive.com/news/china-says-it-expects-to-hold-trade-talks-with-the-us-in-the-near-future-20260224/,CNY,China says it expects to hold trade talks with the US in the near future,"Well, you can certainly bet that Beijing is smirking and if not laughing with glee over the whole situation. Their hard line stance against Trump looks to be paying off now as the US administration is forced to back down on the high tariffs applied against China. And one can reasonably assume that this will continue to be their tactic in dealing with the US president until his term ends. That is to be patient and ride out the storm.The Chinese commerce ministry is out with some remarks now, in r"
2026-02-24,e366b145b519,ForexLive,https://investinglive.com/news/china-adds-20-japanese-firms-to-export-control-list-tightening-dual-use-trade-20260224/,CNY,"China adds 20 Japanese firms to export control list, tightening dual-use trade","China moved to restrict dual-use exports to 20 Japanese entities, a fresh escalation in trade frictions amid already strained bilateral ties.Summary:China’s Commerce Ministry adds 20 Japanese entities to an export control “watch list”Measures ban exports of dual-use items to listed entities without licencesOverseas parties also barred from re-transferring China-origin dual-use items to themBeijing cites inability to verify end-users/end-uses, and frames move as curbing Japan “remilitarisation”In"
2026-02-24,0bccb0beea40,ForexLive,https://investinglive.com/news/economic-and-event-calendar-in-asia-tuesday-february-24-2026-china-and-japan-return-20260223/,CNY,"Economic and event calendar in Asia Tuesday, February 24, 2026 - China and Japan return","It's a near empty economic calendar today. I was expecting the People's Bank of China to set its Loan Prime Rates (LPRs) yesterday but I was out by 24 hours. Its today. Markets overwhelmingly expect the People’s Bank of China to leave its benchmark lending rates untouched, with the 1-year Loan Prime Rate seen holding at 3.00% and the 5-year at 3.50%. Economists argue that commercial lenders are already grappling with historically thin net interest margins, meaning any further trimming of the LPR"
2026-02-24,ada0606c0f1f,FXStreet,https://www.fxstreet.com/news/china-ai-strategy-deepens-global-tech-rivalry-bnp-paribas-202602242056,CNY,China: AI strategy deepens global tech rivalry – BNP Paribas,"BNP Paribas highlights that China has placed artificial intelligence at the core of its development and security strategy, aiming to extend its technological dominance."
2026-02-24,497764ff88f7,ForexLive,https://investinglive.com/news/investinglive-americas-market-news-wrap-us-consumer-confidence-bounces-from-11-year-low-20260224/,USD,investingLive Americas market news wrap: US consumer confidence bounces from 11-year low,"US February consumer confidence 91.2 vs 87.0 expectedRichmond Fed composite index for February -10 versus -8 estimateBOE's Bailey: Services prices inflation has not eased as much as we thought it wouldHome Depot's Q4 earnings tell the story of a ""frozen home environment""Fed's Cook: AI transition could have profound implications but it's too early to knowFed's Collins: Recent jobs data has been promisingUS December CaseShiller 20-city house price index +1.4% vs +1.4% y/y expectedFed's Goolsbee op"
2026-02-24,c92f48b735b8,ForexLive,https://investinglive.com/news/richmond-fed-composite-index-for-february-10-versus-8-estimate-20260224/,USD,Richmond Fed composite index for February -10 versus -8 estimate,Prior month -6Details:Composite manufacturing index fell to -10 in February from -6 in January. Estimate was -8Shipments dropped to -13 from -5 last monthNew orders decreased to -9 from -6 lat monthEmployment edged down to -7 from -6 last monthLocal business conditions index declined to -15 from -8 last monthPrices paid and received growth rates slowed in February to 6.52 from 7.06 last monthPrices received also slowed to 4.25 from 4.58 last monthCapital expenditures rose to -5 from -16 last mon
2026-02-24,ac4721933ab9,ForexLive,https://investinglive.com/news/investinglive-asia-pacific-fx-news-wrap-tariff-uncertainty-persists-china-rises-20260224/,USD,"investingLive Asia-Pacific FX news wrap: Tariff uncertainty persists, China rises","Apple to move some Mac mini production to Houston in 2026 – WSJChina adds 20 Japanese firms to export control list, tightening dual-use tradeChina stocks jump as U.S. tariff ruling boosts export hopesUSD/CNY drops to 2½-year low as onshore yuan surgesChina holds loan prime rates steady as growth slows and yuan firmsPBOC sets USD/ CNY reference rate for today at 6.9414 (vs. estimate at 6.9249)People's Bank of China sets 1 and 5 year Loan Prime Rates (LPRs) unchangedBank of Korea meet Feb 26 - pre"
2026-02-24,57a741c958ec,ForexLive,https://investinglive.com/news/us-february-dallas-fed-manufacturing-index-02-vs-12-prior-20260223/,USD,US February Dallas Fed manufacturing index +0.2 vs -1.2 prior,"General business activity: +0.2 (prev. -1.2)Production: 12.5 (prev. 12.2)New orders: 11.1 (unchanged)Capacity utilization: 11.8 (prev. 6.8)Employment: 7.5 (unchanged)Hours worked: 6.1 (prev. 0.7)Finished goods prices paid: 17.9 (unchanged)Raw materials prices paid: 31.7 (prev. 36.7)Wages and benefits: 31.9 (prev. 17.4)Texas factory activity continued to expand in February, with the Dallas Fed's production index holding largely steady at 12.5, pointing to an above-average pace of output growth. T"
2026-02-24,6294cb8aa0cc,FXStreet,https://www.fxstreet.com/news/forex-today-us-dollar-firms-after-trumps-tariff-ruling-and-hawkish-fed-stance-202602242033,USD,Forex Today: US Dollar firms after Trump’s tariff ruling and hawkish Fed stance,The US Dollar (USD) is on a green note on Tuesday after recovering from Monday’s decline as investors digested the United States (US) Supreme Court ruling against President Donald Trump's tariffs and the new round of levies he announced last weekend.
2026-02-24,6b139a9e3732,FXStreet,https://www.fxstreet.com/news/usd-chf-price-forecast-tests-20-day-sma-as-franc-outperforms-202602242013,USD,USD/CHF Price Forecast: Tests 20-day SMA as Franc outperforms,"USD/CHF edges lower during the North American session on Tuesday, down 0.20%, even though the US Dollar (USD) posted solid gains against most of its peers, except the Swiss Franc (CHF)."
2026-02-24,4b973fd1ffe6,FXStreet,https://www.fxstreet.com/news/inr-cautious-relief-after-us-tariff-ruling-dbs-202602241943,USD,INR: Cautious relief after US tariff ruling – DBS,"DBS Group Research economist Radhika Rao notes that India’s markets reacted with cautious optimism after a US court ruling against tariffs, with the Indian Rupee posting a modest relief rally from near the 91-per-Dollar level."
2026-02-24,6f14f69c9f60,FXStreet,https://www.fxstreet.com/news/gold-pulls-back-from-5-249-as-us-dollar-firms-on-fed-rhetoric-202602241900,USD,"Gold pulls back from $5,249 as US Dollar firms on Fed rhetoric","Gold price retreats from three-week high of $5,249 on Tuesday as the Greenback pares some of Monday’s losses on uncertainty about trade policies and hawkish comments by some Federal Reserve (Fed) officials. At the time of writing, XAU/USD trades at $5,160, down 1.24%."
2026-02-24,52a11f9a060d,FXStreet,https://www.fxstreet.com/news/usd-krw-range-trade-with-slight-downside-bias-ocbc-202602241828,USD,USD/KRW: Range trade with slight downside bias – OCBC,"OCBC’s Sim Moh Siong and Christopher Wong note that USD/KRW has traded lower but remains range-bound, supported by strong Korean exports and better sentiment. While US tariff uncertainty can be USD-negative, broader risk-off could still cap KRW gains."
2026-02-24,874083a9e125,FXStreet,https://www.fxstreet.com/news/usd-jpy-price-forecast-bullish-bias-builds-above-15500-support-202602241752,USD,USD/JPY Price Forecast: Bullish bias builds above 155.00 support,USD/JPY trades on the front foot on Tuesday as the Japanese Yen (JPY) weakens broadly after reports that Japan’s Prime Minister Sanae Takaichi signaled caution over further Bank of Japan (BoJ) rate hikes during a meeting with Governor Kazuo Ueda last week.
2026-02-24,89e0b5df05f1,FXStreet,https://www.fxstreet.com/news/gbp-usd-rises-past-13500-as-bailey-hints-at-easing-us-dollar-firms-202602241633,USD,GBP/USD rises past 1.3500 as Bailey hints at easing despite firmer US Dollar,"The Pound Sterling (GBP) trades higher on Tuesday even though the Bank of England (BoE) Governor opened the door for further easing, amid uncertainty over US trade policies. At the time of writing, GBP/USD exchanges hands near the 1.3530 figure, up 0.30%"
2026-02-24,cab3cedb215d,FXStreet,https://www.fxstreet.com/news/usd-jpy-advances-on-us-confidence-rebound-japanese-monetary-policy-concerns-202602241616,USD,"USD/JPY advances on US confidence rebound, Japanese monetary policy concerns","USD/JPY trades around 155.95 on Tuesday at the time of writing, up 0.80% on the day, supported by the strength of the US Dollar (USD) amid firmer US macroeconomic data and persistent weakness in the Japanese Yen (JPY)."
2026-02-24,05c2e09cae13,FXStreet,https://www.fxstreet.com/news/usd-cad-steadies-as-stronger-us-dollar-pressures-loonie-202602241615,USD,USD/CAD steadies as stronger US Dollar pressures Loonie,"USD/CAD trades flat on Tuesday as a firmer US Dollar (USD) keeps the Canadian Dollar (CAD) under modest pressure. At the time of writing, the pair is trading around 1.3705, after touching an intraday high near 1.3725."
2026-02-24,4564eb4dd4ce,FXStreet,https://www.fxstreet.com/news/silver-price-forecast-xag-usd-pulls-back-from-89-as-tariff-rally-fades-into-profit-taking-202602241608,USD,Silver Price Forecast: XAG/USD pulls back from $89 as tariff rally fades into profit-taking,"Spot Silver is pulling back on Tuesday after Monday's explosive rally, trading near $87.87. The weekend tariff escalation, which came just hours after the US Supreme Court struck down broader emergency tariffs, fuelled a flight into precious metals."
2026-02-24,caa07d563197,FXStreet,https://www.fxstreet.com/news/nzd-usd-struggles-as-us-dollar-gains-on-fed-signals-trade-tensions-202602241435,USD,"NZD/USD struggles as US Dollar gains on Fed signals, trade tensions","NZD/USD trades around 0.5950 on Tuesday at the time of writing, down 0.14% on the day, after failing to establish a sustained move above the 0.6000 level."
2026-02-24,6aca6374fa73,FXStreet,https://www.fxstreet.com/news/usd-squeeze-risk-on-geopolitical-escalation-ocbc-202602241431,USD,USD: Squeeze risk on geopolitical escalation – OCBC,"OCBC’s Sim Moh Siong and Christopher Wong argue that conditions for a sustained US Dollar rebound remain absent, but heavy speculative shorts leave the currency vulnerable to a squeeze."
2026-02-24,95e1070dae4b,NewsAPI (The Times of India),https://timesofindia.indiatimes.com/city/patna/sakri-raiyam-sugar-mills-to-be-revived/articleshow/128726472.cms,USD,"Sakri, Raiyam sugar mills to be revived",Patna: State’s cooperative department on Monday signed a memorandum of understanding (MoU) with the National Federation of Cooperative Sugar Factories.
2026-02-24,ccb607703b7e,NewsAPI (CNA),https://www.channelnewsasia.com/business/cryptocom-gets-conditional-us-approval-national-trust-bank-charter-5948021,USD,Crypto.com gets conditional US approval for national trust bank charter,"Feb 23 : Crypto.com said on Monday it has received conditional approval from the Office of the Comptroller of the Currency for a national trust bank charter, paving the way for the digital assets firm to become a federally regulated custodian.The approval com…"
2026-02-24,2b52a30cae1a,NewsAPI (Financial Post),https://financialpost.com/pmn/business-pmn/omers-earns-6-as-stock-gains-offset-losses-from-pe-us-dollar,USD,"Omers Earns 6% as Stock Gains Offset Losses From PE, US Dollar",Ontario Municipal Employees Retirement System returned 6% last year after gains from stock holdings and private credit more than offset private equity losses and a weak dollar.
2026-02-24,5b539abc7e8c,NewsAPI (Financial Post),https://financialpost.com/fp-finance/omers-stock-gains-offset-losses-pe-us-dollar,USD,"OMERS earns 6% as stock gains offset losses from private equity, U.S. dollar",OMERS returned 6% last year after gains from stock holdings and private credit more than offset private equity losses. Read more.
2026-02-24,4cc05209e2d7,Yahoo Finance,https://finance.yahoo.com/news/walmart-dollar-stores-beat-traditional-133039370.html,USD,"Walmart, Dollar Stores Beat Traditional Grocers' Reach As Affordability Crunch Intensifies, Report Finds",
2026-02-24,a96742d0bed0,Yahoo Finance,https://finance.yahoo.com/news/chipotle-mexican-grill-stock-analyst-124210963.html,MXN,Chipotle Mexican Grill Stock: Analyst Estimates & Ratings,
2026-02-24,697bbda20e8b,ForexLive,https://investinglive.com/news/investinglive-european-fx-news-wrap-jpy-down-as-takaichi-opposes-further-boj-rate-hikes-20260224/,EUR,investingLive European FX news wrap: JPY down as Takaichi opposes further BoJ rate hikes,"Fed's Bostic: even with rising productivity, the Fed needs to keep focus on inflationMacro and geopolitical risks keep a lid on the Nasdaq: What's next for the market?Australian Dollar in the spotlight ahead of the monthly CPI report. What's next?Dollar may yet benefit from further US-Iran geopolitical escalation - BofAThe Japanese Yen sinks as PM Takaichi signals opposition to further BoJ rate hikesChina says it expects to hold trade talks with the US in the near futureFrench business climate c"
2026-02-24,4baf6e9849b5,ForexLive,https://investinglive.com/news/what-are-the-main-events-for-today-20260224/,EUR,What are the main events for today?,"EUROPEAN SESSIONIn the European session, we don't have much on the agenda other than the French business confidence data which is not going to change anything for the ECB, so the market reaction will be muted. AMERICAN SESSIONIn the American session, we get the weekly US ADP jobs data and the US Consumer Confidence report. The weekly ADP was a market moving indicator only on the first releases, then it stopped being important. Nonetheless, the data has been showing significant improvement like m"
2026-02-24,4b9f9e3d0777,ForexLive,https://investinglive.com/news/investinglive-americas-fx-news-wrap-23-feb-usd-is-mixed-as-markets-react-to-tariff-news-20260223/,EUR,investingLive Americas FX news wrap 23 Feb: USD is mixed as markets react to tariff news,"Major US stock indices close lower as markets ponder uncertainty from tariffsRBA Economist Plumb Focuses on CPI for ForecastingCrude oil futures settle at $66.31. Buyers failed to keep momentum going.Mortgage rates fall below 6% for the first time since September 2025ECB's Lagarde: Inflation in policy are in a good placeGold. Silver. Bitcoin.What are the charts in these ""currencies"" telling traders right not?What technical levels are in play for the broader US stock indices?US February Dallas Fe"
2026-02-24,56c50b657c57,ForexLive,https://investinglive.com/news/european-parliament-postpones-vote-on-eu-us-trade-deal-report-20260223/,EUR,European Parliament postpones vote on EU-US trade deal - report,"Everything about how Europe has negotiated tariffs has been a disaster. They were the one jurisdiction with the market size and diversification to stand up to US tariffs and they folded in pathetic fashion despite the likelihood -- now proven -- that the US Supreme Court would strike down tariffs.Now they want a do-over and, luckily their terrible deal with the US hasn't been ratified by European Parliament so they will get it. However now they've irked the US and missed their best opportunity t"
2026-02-24,4c1415b4053f,FXStreet,https://www.fxstreet.com/news/eur-usd-supreme-court-tariff-ruling-and-fed-speaker-lineup-drive-midweek-volatility-202602241600,EUR,EUR/USD: Supreme Court tariff ruling and Fed speaker lineup drive midweek volatility,The Euro (EUR) is trading near the 1.1775 level on Tuesday after recovering from a one-month low last week.
2026-02-24,c304b523f8e8,FXStreet,https://www.fxstreet.com/news/european-gas-weather-relief-but-new-risks-commerzbank-202602241506,EUR,European gas: Weather relief but new risks – Commerzbank,"Commerzbank’s Norman Liebke notes European gas prices have stabilized as milder weather reduces withdrawals from storage, with low withdrawal rates likely to persist in coming weeks."
2026-02-24,8289b1a2446f,NewsAPI (GlobeNewswire),https://www.globenewswire.com/news-release/2026/02/23/3243014/0/en/Galapagos-Reports-Full-Year-2025-Financial-Results-and-Provides-Fourth-Quarter-Business-Update.html,EUR,Galapagos Reports Full Year 2025 Financial Results and Provides Fourth Quarter Business Update,"Mechelen, Belgium; February 23, 2026, 22:01 CET; regulated information – Galapagos NV (Euronext & NASDAQ: GLPG) today reported its financial results for the full year 2025 and provided an update on the fourth quarter 2025 and its year-to-date performance."
2026-02-24,aefb0c3e9a96,ForexLive,https://investinglive.com/news/economic-event-calendar-in-asia-wednesday-february-25-2026-australian-inflation-data-20260224/,AUD,"Economic & event calendar in Asia Wednesday, February 25, 2026: Australian inflation data","The focus is the Australian CPI data for January:Australia January CPI preview: core inflation steady, electricity lifts headlineTrump will speak later. State of the Union speech. His centrepiece economic policy has completely collapsed. He's scrambling to recover:Trump considers new Section 232 tariffs after Supreme Court ruling This article was written by Eamonn Sheridan at investinglive.com."
2026-02-24,cb786240f7d0,ForexLive,https://investinglive.com/news/australia-january-cpi-preview-core-inflation-steady-electricity-lifts-headline-20260223/,AUD,"Australia January CPI preview: core inflation steady, electricity lifts headline","January CPI is set to show electricity-driven headline strength and still-firm core inflation, keeping a May RBA hike in play.Summary:Headline CPI seen at 0.4% m/m (seasonally adjusted) in JanuaryAnnual inflation forecast at 3.6–3.7% y/yElectricity prices a key upside driver; fuel partly offsetsTrimmed mean seen at 0.3% m/m, annual pace steady at 3.3%RBA still expected to hike in May despite slight core moderationAustralia’s January CPI, due from the Australian Bureau of Statistics on Wednesday "
2026-02-24,ff3c47833fac,FXStreet,https://www.fxstreet.com/news/australia-cpi-set-to-show-persistent-inflation-reinforcing-hawkish-rate-outlook-202602242000,AUD,"Australia CPI expected to point to sticky inflation, supporting hawkish stance","Australia will release its key set of inflation figures for the month of January on Wednesday, with the Consumer Price Index (CPI) expected to rise by 3.7%, slightly lower than the 3.8% in the last month of 2025."
2026-02-24,72e1cb989245,NewsAPI (The Times of India),https://timesofindia.indiatimes.com/city/patna/alumni-recall-rich-legacy-of-dmc-on-foundation-day/articleshow/128725328.cms,AUD,Alumni recall rich legacy of DMC on foundation day,"Darbhanga Medical College celebrated its 101st Foundation Day with a series of events, including an alumni meet and academic sessions. Rajya Sabha member Sanjay Kumar Jha urged the institution to lead in emerging medical technologies like AI. Speakers lauded …"
2026-02-25,08069fc7ef20,FXStreet,https://www.fxstreet.com/news/gbp-jpy-price-forecast-clears-key-resistance-aims-towards-21200-202602252057,GBP,"GBP/JPY Price Forecast: Clears key resistance, aims towards 212.00","The GBP/JPY rallies for the second straight day, up by over 0.80% as Yen weakness extends, as the Japanese Prime Minister Takaichi nominates two slightly “dovish” academics to the Bank of Japan’s board. The cross trades at 211.94, slightly below the day’s high of 212.12."
2026-02-25,f7fdea0ed481,Yahoo Finance,https://finance.yahoo.com/news/united-airlines-selects-ge-aerospace-144245024.html,GBP,United Airlines selects GE Aerospace (GE)’s GEnx Engines for Boeing 787,
2026-02-25,e1cacdae1c57,Yahoo Finance,https://finance.yahoo.com/news/boeing-company-ba-777-9-144323026.html,GBP,The Boeing Company’s (BA) 777-9 Flight Training Simulators Receives Qualification Certification,
2026-02-25,ec2f502b5fad,ForexLive,https://investinglive.com/news/investinglive-asia-pacific-fx-news-wrap-nikkei-record-high-australian-cpi-high-sticky-20260225/,JPY,"investingLive Asia-Pacific FX news wrap: Nikkei record high, Australian CPI high & sticky","Trump says Iran advancing missile, nuclear programs despite negotiationsJapan govmt nominates new BOJ board members as rate-hike path comes into focusSOTU Trump: Says tariffs stay despite Supreme Court loss, pivots to new global levyNikkei hits record high as AI fears fade and yen weakensOil holds near seven-month highs ahead of US-Iran Geneva talks, EIA data awaitedAdvance excerpts of Trump's speech show its lacklusterJapan services inflation holds at 2.6%, keeping BOJ hike bias intactPBOC sets"
2026-02-25,27f8a3fc1c71,FXStreet,https://www.fxstreet.com/news/jpy-reflationist-boj-picks-flag-downside-risks-mufg-202602251345,JPY,JPY: Reflationist BoJ picks flag downside risks – MUFG,MUFG’s Head of Research Derek Halpenny highlights renewed Japanese Yen underperformance as Prime Minister Takaichi nominates reflationist-leaning academics Toichiro Asada and Ayano Sato to the BoJ policy board.
2026-02-25,bc4da34fd3e6,FXStreet,https://www.fxstreet.com/news/aud-jpy-price-forecast-skyrockets-past-11100-on-hot-aussie-cpi-202602252222,JPY,AUD/JPY Price Forecast: Skyrockets past 111.00 on hot Aussie CPI,"The AUD/JPY rallies over 1.20% on Wednesday, after an inflation report in Australia prompted investors to price additional rate hikes by the Reserve Bank of Australia (RBA). At the time of writing, the cross trades at 111.38."
