date,article_id,source,url,currency,title,snippet
2026-03-10,4b686b9c2a4e,FXStreet,https://www.fxstreet.com/news/gbp-boe-repricing-and-eur-gbp-support-zone-ing-202603101024,EUR,GBP: BoE repricing and EUR/GBP support zone – ING,"ING’s Chris Turner highlights that UK rate markets have seen one of the largest repricings from the energy shock, reflecting high UK inflation and a relatively hawkish Bank of England."
2026-03-10,29b2df3bf2d7,FXStreet,https://www.fxstreet.com/news/ecbs-muller-we-shouldnt-rush-into-any-decision-202603101014,EUR,ECB’s Muller: We shouldn't rush into any decision,European Central Bank (ECB) economist Georg Muller said on Tuesday that “we shouldn't rush into any decision.”
2026-03-10,2b5371455b46,FXStreet,https://www.fxstreet.com/news/ecbs-simkus-important-to-stay-calm-for-next-policy-meeting-dont-overreact-202603101011,EUR,"ECB’s Simkus: Important to stay calm for next policy meeting, don't overreact","European Central Bank (ECB) Governing Council member and head of Lithuania's central bank, Gediminas Simkus, commented on the bank’s monetary policy outlook in the face of the war in the Middle East."
2026-03-10,a1901f0db69c,FXStreet,https://www.fxstreet.com/news/wti-remains-stronger-around-8650-as-strait-of-hormuz-disrupts-oil-supply-202603100915,EUR,WTI remains stronger around $85.50 as Strait of Hormuz disrupts oil supply,"West Texas Intermediate (WTI) crude oil price remains in the positive territory despite experiencing heavy volatility, trading around $85.50 per barrel during the European hours on Tuesday."
2026-03-10,0048441a51f7,FXStreet,https://www.fxstreet.com/news/eur-usd-support-holds-as-oil-shock-reprices-rates-ing-202603100905,EUR,EUR/USD: Support holds as Oil shock reprices rates – ING,"ING’s Chris Turner reports that EUR/USD held the 1.1500 level despite pressure, with options markets not positioning for a major downside break. He notes that the energy shock has driven a stronger repricing of Euro and Pound rates than US rates, potentially narrowing EUR:USD swap differentials."
2026-03-10,735a6a539e52,FXStreet,https://www.fxstreet.com/news/gold-rises-as-geopolitical-risks-underpin-safe-haven-demand-usd-strength-limits-gains-202603100436,EUR,"Gold struggles to build on intraday gains, remains below $5,200 amid positive risk tone","Gold (XAU/USD) sticks to modest intraday gains heading into the European session on Tuesday, though it lacks follow-through buying and remains below the $5,200 mark."
2026-03-10,a201dddc9db0,FXStreet,https://www.fxstreet.com/news/ecb-market-questions-zero-tolerance-stance-commerzbank-202603100816,EUR,ECB: Market questions zero-tolerance stance – Commerzbank,"Commerzbank’s Christoph Rieger notes that markets have sharply repriced ECB expectations after the recent oil-driven sell-off, now discounting a more aggressive, zero-tolerance stance on inflation and higher year-end rates."
2026-03-10,a8e23884597c,FXStreet,https://www.fxstreet.com/news/gbp-usd-price-forecast-eyes-50-day-ema-barrier-near-13500-despite-ongoing-bearish-bias-202603100801,EUR,GBP/USD Price Forecast: Eyes 50-day EMA barrier near 1.3500 despite ongoing bearish bias,"GBP/USD extends its gains for the third successive session, trading around 1.3480 during the early European hours on Tuesday."
2026-03-10,2020ecd5a459,FXStreet,https://www.fxstreet.com/news/aud-jpy-price-forecast-gains-traction-above-100-day-ema-with-bullish-rsi-momentum-202603100708,EUR,AUD/JPY Price Forecast: Gains traction above 100-day EMA with bullish RSI momentum,"The AUD/JPY cross trades in positive territory near 111.80 during the early European session on Tuesday. The Australian Dollar (AUD) strengthens against the Japanese Yen (JPY) as China's trade surplus grew more than expected at the beginning of 2026, driven by a significant surge in exports."
2026-03-10,5344cb5f2a14,MarketWatch,https://www.marketwatch.com/story/european-bonds-join-treasury-rally-as-lower-oil-prices-ease-inflation-fears-c317b735?mod=mw_rss_topstories,EUR,European bonds join Treasury rally as lower oil prices ease inflation fears,Benchmark Treasury yields are hovering near the middle of their months-long trading range as fears fade of an inflation shock caused by surging oil prices.
2026-03-10,63aab628f133,ForexLive,https://investinglive.com/news/chinas-trade-data-for-januaryfebruary-came-in-much-stronger-than-expected-20260310/,USD,China’s trade data for January–February came in much stronger than expected,"China’s trade data for January–February came in much stronger than expected.Exports (USD terms) rose 21.8% y/y (expected 7.1%, previous 6.6%).Imports (USD terms) increased 19.8% y/y (expected 6.3%, previous 5.7%).Trade balance printed at $213.62B, well above the $179.6B forecast (previous $114.10B).--Added, more detail here:China exports surge 21.8% as trade surplus widens at start of 2026 - more detail This article was written by Eamonn Sheridan at investinglive.com."
2026-03-10,07f34748198a,ForexLive,https://investinglive.com/news/investinglive-asia-pacific-fx-news-wrap-trumps-mixed-messages-on-his-war-20260310/,USD,investingLive Asia-Pacific FX news wrap: Trump’s mixed messages on his war,"ICYMI: Goldman Sachs & Barclays warn sustained oil surge could push US inflation toward 3%Trump advisers urge Iran war exit plan amid epic oil price surge. Epic Blunder?Recap - Japan upgrades Q4 GDP to 1.3% on strong investment, Iran war clouds outlookPBOC sets USD/ CNY reference rate for today at 6.8982 (vs. estimate at 6.8891)Iran plans shipping levies in Gulf. Trump warns massive retaliation if oil flows disruptedAustralian business confidence turns negative as conditions hold steady (pre war"
2026-03-10,b4d68c7d584b,FXStreet,https://www.fxstreet.com/news/usd-range-retest-as-crude-risk-premium-fades-bbh-202603101119,USD,USD: Range retest as crude risk premium fades – BBH,"Brown Brothers Harriman’s Elias Haddad notes that markets have sharply reduced the crude Oil war risk premium after comments from President Trump, triggering a pullback in the Dollar and a rally in global stocks and bonds."
2026-03-10,4a40bd090970,FXStreet,https://www.fxstreet.com/news/silver-price-today-silver-rises-according-to-fxstreet-data-202603100930,USD,"Silver price today: Silver rises, according to FXStreet data","Silver prices (XAG/USD) rose on Tuesday, according to FXStreet data. Silver trades at $89.34 per troy ounce, up 2.66% from the $87.03 it cost on Monday."
2026-03-10,f34587568c80,FXStreet,https://www.fxstreet.com/news/indian-rupee-remains-under-pressure-as-usd-inr-nears-record-highs-202603100503,USD,USD/INR remains flat after paring recent gains as US Dollar weakens,"USD/INR rebounds after registering little losses in the previous session. However, the pair reached an all-time high of 92.81 on Monday as the Indian Rupee (INR) faces intense selling pressure amid increased risk aversion and higher oil prices."
2026-03-10,aabc8bf61753,FXStreet,https://www.fxstreet.com/news/brent-volatile-spike-and-policy-response-commerzbank-202603100849,USD,Brent: Volatile spike and policy response – Commerzbank,Commerzbank analysts describe a dramatic surge in Brent oil toward USD120 before prices eased after President Trump signalled the Iran war could be resolved soon.
2026-03-10,4206f074bcd6,FXStreet,https://www.fxstreet.com/news/usd-softer-tone-as-conflict-risks-reassessed-mufg-202603100840,USD,USD: Softer tone as conflict risks reassessed – MUFG,MUFG’s Senior Currency Analyst Lee Hardman notes the US Dollar has weakened as President Trump’s comments reduced fears of a prolonged Middle East conflict and Oil reversed sharply from recent highs.
2026-03-10,ffb87e700d83,FXStreet,https://www.fxstreet.com/news/forex-today-us-dollar-retreats-as-mood-improves-on-falling-oil-prices-202603100751,USD,Forex Today: US Dollar retreats as mood improves on falling Oil prices,"Here is what you need to know on Tuesday, March 10:"
2026-03-10,bb24b9a77cbf,FXStreet,https://www.fxstreet.com/news/gold-safe-haven-bid-seen-on-dips-ocbc-202603100726,USD,Gold: Safe-haven bid seen on dips – OCBC,OCBC strategists Sim Moh Siong and Christopher Wong attribute Gold’s pullback toward USD5015/oz to liquidity needs and profit‑taking rather than weaker fundamentals.
2026-03-10,30537e2c51bd,FXStreet,https://www.fxstreet.com/news/silver-price-forecast-xag-usd-seems-vulnerable-bears-await-acceptance-below-8000-202603090145,USD,Silver Price Forecast: XAG/USD targets further upside beyond $90.00; 100-SMA holds the key,"Silver (XAG/USD) attracts buyers for the third straight day and climbs to over a one-week high, around the 90.00 psychological mark, during the first half of the trading action on Tuesday. Moreover, the supportive technical setup backs the case for a further near-term appreciating move."
2026-03-10,1347ad1d74a1,FXStreet,https://www.fxstreet.com/news/fed-conflict-complicates-rate-cut-path-bny-202603100641,USD,Fed: Conflict complicates rate-cut path – BNY,"BNY’s Americas Macro Strategist John Velis argues that the Middle East conflict hits the U.S. economy via higher Oil prices, weaker portfolios and greater uncertainty, creating a negative supply shock."
2026-03-10,4d40de1d46cc,NewsAPI (BusinessLine),https://www.thehindubusinessline.com/markets/forex/rupee-falls-53-paise-to-close-at-all-time-low-of-9235-against-us-dollar/article70722155.ece,USD,Rupee falls 53 paise to close at all-time low of 92.35 against US dollar,"At the interbank foreign exchange, the rupee opened at 92.22 and rose briefly to 92.15 but kept losing ground through the session before eventually settling at its all-time low of 92.35"
2026-03-10,c1ebfc5e267e,NewsAPI (newsBTC),http://www.newsbtc.com/analysis/solana-sol-tumbles-to-80/,USD,"Solana (SOL) Tumbles to $80, Traders Watch Critical Support Defense",Solana failed to settle above $90 and extended losses. SOL price is now consolidating losses below $85 and might struggle to start a recovery wave. SOL price started a fresh decline below $85 and $82 against the US Dollar. The price is now trading below $85 a…
2026-03-10,d66f820a0a24,FXStreet,https://www.fxstreet.com/news/jpy-june-hike-prospects-support-currency-ing-202603100709,JPY,JPY: June hike prospects support currency – ING,"ING's Senior Economist Min Joo Kang argues that stronger Japan GDP data and resilient private spending support continued Bank of Japan (BoJ) policy normalisation, with a rate hike more likely in June than April."
2026-03-10,826caaf310d8,FXStreet,https://www.fxstreet.com/news/bojs-nakamura-appropriate-to-conduct-bond-taper-in-predictable-manner-202603100700,JPY,BoJ’s Nakamura: Appropriate to conduct bond taper in predictable manner,Bank of Japan (BoJ) Executive Director Koji Nakamura said on Tuesday that it’s appropriate to conduct a bond taper in a predictable manner. Nakamura further stated that he will listen to views of various market players in compiling a new bond taper plan at the June policy meeting.
2026-03-10,d738834b908e,ForexLive,https://investinglive.com/news/australian-business-confidence-turns-negative-as-conditions-hold-steady-pre-war-survey-20260310/,AUD,Australian business confidence turns negative as conditions hold steady (pre war survey),"Australian business conditions hold steady while confidence slips into negative territory.Note - this survey was taken before the war. With the surge in energy prices confidence will not have improved. Summary:Australian business conditions held steady in February, while confidence slipped into negative territory.The NAB business conditions index remained at +7, around its long-run average.Business confidence fell sharply to -1 from +4, the first negative reading in almost a year.Sales strengthe"
2026-03-10,57a8a2030177,ForexLive,https://investinglive.com/news/australian-consumer-sentiment-rebounds-slightly-but-inflation-fears-surge-20260309/,AUD,Australian consumer sentiment rebounds slightly but inflation fears surge,"Australian consumer sentiment edges higher but households remain pessimistic as inflation fears rise.Summary:Australian consumer sentiment rose modestly in March, breaking a three-month run of declines.The Westpac–Melbourne Institute index increased 1.2% to 91.6, though pessimists still outnumber optimists.Sentiment deteriorated later in the survey period as the U.S.–Israeli war with Iran intensified.Inflation expectations surged to 6.1%, marking the largest weekly increase since the series bega"
2026-03-10,58fae5d9c788,FXStreet,https://www.fxstreet.com/news/rba-market-weighs-live-march-hike-risk-td-securities-202603100950,AUD,RBA: Market weighs live March hike risk – TD Securities,TD Securities’ Senior Strategist Prashant Newnaha highlights that recent comments from RBA Deputy Governor Hauser sound hawkish and reinforce Governor Bullock’s message that the March Board meeting is live.
2026-03-10,18cc86d541df,FXStreet,https://www.fxstreet.com/news/saudi-aramco-ceo-i-am-concerned-about-elevated-risks-that-people-are-facing-in-region-202603100649,AUD,Saudi Aramco CEO: I am concerned about elevated risks that people are facing in region,"The President and CEO of Saudi Aramco, Amin H. Nasser, said on Tuesday that he is concerned about the elevated risks that people are facing in the region. He added that the company are doing its best to meet the majority of our customers' requirements under the current circumstances."
2026-03-10,29d262c267f9,MarketWatch,https://www.marketwatch.com/story/saudi-aramco-promises-full-production-can-be-restored-within-days-if-strait-of-hormuz-is-reopened-5741bad3?mod=mw_rss_topstories,AUD,Saudi Aramco promises full production can be restored within days if Strait of Hormuz is reopened,Aramco’s CEO warns of “catastrophic consequences” for the oil market if the effective closure of the Straits Of Hormuz were to remain for an extended period. He was unenthusiastic about prospects for the U.S. Navy escorting tankers in transit.
2026-03-10,54a0d531a797,Yahoo Finance,https://finance.yahoo.com/news/finastra-integrates-fraudaverse-ai-support-115818005.html,AUD,Finastra integrates FraudAverse AI to support fraud prevention for banks,
2026-03-10,bc8d8b5ee503,NewsAPI (Financial Post),https://financialpost.com/pmn/business-wire-news-releases-pmn/rb-global-announces-intended-us500-million-share-repurchase-program,AUD,RB Global Announces Intended US$500 Million Share Repurchase Program,"WESTCHESTER, Ill. — RB Global, Inc. (NYSE: RBA) (TSX: RBA) (the “Company” or “RB Global”) today announced that its Board of Directors has authorized a new share repurchase program under which the Company may repurchase up to US$500 million worth of its common…"
2026-03-10,449bbe65f308,NewsAPI (BusinessLine),https://www.thehindubusinessline.com/opinion/editorial/editorial-stress-management/article70718650.ece,CAD,Editorial. Stress management,"CAD may widen, but is no cause for alarm"
2026-03-10,3b3e59a9133e,FXStreet,https://www.fxstreet.com/news/nok-inflation-pressures-challenge-norges-bank-nordea-202603100922,NOK,NOK: Inflation pressures challenge Norges Bank – Nordea,"Nordea’s Kjetil Olsen notes that Norwegian core inflation remains at 3.0%, above Norges Bank’s projections and far from its 2% target, with unemployment lower than expected."
2026-03-10,752911609f98,ForexLive,https://investinglive.com/news/china-exports-surge-218-as-trade-surplus-widens-at-start-of-2026-more-detail-20260310/,CNY,China exports surge 21.8% as trade surplus widens at start of 2026 - more detail,"China exports surge at start of 2026 as trade surplus widens sharply.Summary:China’s exports surged 21.8% y/y in January–February, far exceeding expectations and accelerating sharply from December’s 6.6% growth.The country recorded a $213.6B trade surplus, well above forecasts and last year’s level.Imports also jumped 19.8% y/y, suggesting stronger trade flows despite weak domestic demand.China’s export strength continues despite renewed U.S. tariffs, with manufacturers shifting shipments toward"
2026-03-10,0c28930a2a50,FXStreet,https://www.fxstreet.com/news/cny-export-strength-underpins-currency-commerzbank-202603100630,CNY,CNY: Export strength underpins currency – Commerzbank,"Volkmar Baur highlights exceptionally strong Chinese export data, with February exports up nearly 40% year-on-year and the combined January–February surplus reaching about 6.2% of GDP."
2026-03-10,29ac8aa4073e,Yahoo Finance,https://finance.yahoo.com/news/tesla-inc-tsla-uk-car-113139218.html,CNY,"Tesla, Inc. (TSLA) UK Car Sales Fall 37% Amid Heightening Chinese Competition, Reuters Reports",
2026-03-11,5dab130f2305,FXStreet,https://www.fxstreet.com/news/eur-usd-price-forecast-sellers-target-11500-as-bearish-momentum-builds-202603111757,EUR,EUR/USD Price Forecast: Sellers target 1.1500 as bearish momentum builds,The Euro (EUR) edges lower against the US Dollar (USD) on Wednesday as the Greenback remains well supported amid cautious market sentiment driven by the ongoing US-Iran war.
2026-03-11,b691291340f2,FXStreet,https://www.fxstreet.com/news/netherlands-inflation-sensitivity-to-iran-energy-shock-abn-amro-202603111752,EUR,Netherlands: Inflation sensitivity to Iran energy shock – ABN AMRO,"ABN AMRO economists see the Dutch economy broadly mirroring Eurozone dynamics under Iran conflict scenarios, with transmission mainly via higher inflation rather than deep growth damage."
2026-03-11,e146ef0d8789,FXStreet,https://www.fxstreet.com/news/ecbs-schnabel-must-be-vigilant-to-upside-inflation-risks-202603111558,EUR,ECB’s Schnabel: Must be vigilant to upside inflation risks,"Isabel Schnabel, member of the executive board of the European Central Bank (ECB), said on Wednesday that they must monitor the persistence of the energy price shock in Europe and stay vigilant for upside inflation risks, in a speech at the Frankfurt School of Finance and Management Centre for Centr"
2026-03-11,b995012221cf,FXStreet,https://www.fxstreet.com/news/ecb-energy-path-keeps-outlook-uncertain-ing-202603111502,EUR,ECB: Energy path keeps outlook uncertain – ING,"ING strategists Michiel Tukker and Benjamin Schroeder say Euro rates remain highly sensitive to energy dynamics, with European Central Bank hikes still priced for 2026."
2026-03-11,8ebef769a7a3,FXStreet,https://www.fxstreet.com/news/eur-gbp-weakens-as-fading-boe-rate-cut-bets-support-the-pound-202603111502,EUR,EUR/GBP weakens as fading BoE rate-cut bets support the Pound,"EUR/GBP remains under pressure on Wednesday, with the Euro (EUR) extending its decline against the British Pound (GBP) for a fifth consecutive day as traders reassess the monetary policy outlook for the European Central Bank (ECB) and the Bank of England (BoE) amid rising concerns about an Oil-drive"
2026-03-11,f9aec3a70ec4,FXStreet,https://www.fxstreet.com/news/euro-ecb-response-to-new-energy-shock-abn-amro-202603111410,EUR,Euro: ECB response to new energy shock – ABN AMRO,"ABN AMRO economists argue that elevated Oil and gas prices from the Iran conflict would hurt Eurozone growth more than US growth, mainly via real income and confidence."
2026-03-11,477728a936f8,FXStreet,https://www.fxstreet.com/news/eur-gbp-scope-for-corrective-bounce-ing-202603111347,EUR,EUR/GBP: Scope for corrective bounce - ING,"ING’s Francesco Pesole notes EUR/GBP has fallen about 1.5% since the Iran conflict began, helped by a stronger GBP rate profile and resilient equities."
2026-03-11,8d3129ca0f15,FXStreet,https://www.fxstreet.com/news/eur-usd-slips-as-us-cpi-meets-expectations-202603111329,EUR,EUR/USD slips as US CPI meets expectations,"The Euro (EUR) weakens against the US Dollar (USD) on Wednesday as the Greenback strengthens after US inflation data came broadly in line with forecasts. At the time of writing, EUR/USD is trading around 1.1587, extending losses for the second straight day."
2026-03-11,599194748a26,FXStreet,https://www.fxstreet.com/news/eur-usd-limited-downside-versus-oil-shock-mufg-202603111323,EUR,EUR/USD: Limited downside versus Oil shock – MUFG,"MUFG’s Head of Research Derek Halpenny highlighted the US Dollar has strengthened less than regression models implied given the initial 50% surge in crude, with EUR/USD down only 1.7% after Oil retraced."
2026-03-11,b6f06e101755,ForexLive,https://investinglive.com/news/treasury-yields-creep-higher-again-eyes-on-420-20260311/,USD,"Treasury yields creep higher again, eyes on 4.20%","Today's CPI report was bang in-line with estimates so that gives the Fed breathing room to wait and see what happens with prices. What's complicating that is the spike in crude oil due to the Iran war. WTI continues to bounce around and is up $1.52 to $84.90 today after rising as high as $89.The interaction with oil, inflation and growth is top-of-mine for bond investors at the moment. Against that is the bid for safety in a world of tariffs and unprovoked US attacks. US 10-year yields are up 5 "
2026-03-11,7951e7989c94,FXStreet,https://www.fxstreet.com/news/usd-chf-price-forecast-traders-eye-07800-as-rsi-turns-bullish-202603111847,USD,USD/CHF Price Forecast: Traders eye 0.7800 as RSI turns bullish,"USD/CHF posted back-to-back bullish days on Wednesday, rising by over 0.25% after the latest US inflation report and as high energy prices pushed US Treasury yields higher, consequently the US Dollar (USD). At the time of writing, the pair trades near 0.7800."
2026-03-11,1f9bd6b3de0e,FXStreet,https://www.fxstreet.com/news/gold-slips-as-us-dollar-yields-rise-on-oil-driven-inflation-fears-202603111759,USD,"Gold slips as US Dollar, yields rise on Oil-driven inflation fears","Gold (XAU/USD) prices edge lower on Wednesday amid broad US Dollar (USD) strength following the release of US inflation data, which maintained the status quo."
2026-03-11,55989bef9b79,FXStreet,https://www.fxstreet.com/news/usd-cad-price-analysis-us-dollar-rebounds-as-iea-oil-release-weighs-on-cad-202603111746,USD,USD/CAD Price Analysis: US Dollar Rebounds as IEA Oil release weighs on CAD,"The USD/CAD pair is trading near the 1.3580 level, regaining its footing in Wednesday's American session after the International Energy Agency (IEA) agreed to release 400 million barrels of oil to address the supply disruption from the Iran war."
2026-03-11,681524eccf1e,FXStreet,https://www.fxstreet.com/news/silver-price-forecast-xag-usd-falls-as-us-dollar-gains-geopolitical-risks-persist-202603111708,USD,"Silver Price Forecast: XAG/USD falls as US Dollar gains, geopolitical risks persist","Silver (XAG/USD) trades lower on Wednesday, hovering around $85.30 at the time of writing, down 2.12% on the day. The precious metal struggles to extend its recent gains as a rebound in the US Dollar (USD) and higher US Treasury yields weigh on demand for non-yielding assets."
2026-03-11,6051471adbc7,FXStreet,https://www.fxstreet.com/news/usd-jpy-rises-as-oil-supply-fears-and-firm-usd-keep-yen-under-pressure-202603111639,USD,USD/JPY rises as Oil supply fears and firm USD keep Yen under pressure,"USD/JPY extends gains on Wednesday as the Japanese Yen (JPY) remains under pressure amid concerns over Oil supply disruptions linked to the US-Iran war, as Japan relies heavily on imported energy, particularly from the Middle East."
2026-03-11,eda722be7eef,FXStreet,https://www.fxstreet.com/news/nzd-usd-pressured-by-middle-east-war-rbnz-rate-hike-outlook-202603111614,USD,"NZD/USD pressured by Middle East war, RBNZ rate hike outlook","NZD/USD trades lower on Wednesday, hovering around 0.5910 at the time of writing and down 0.38% on the day. The Kiwi remains under pressure as investors stay cautious amid persistent risk aversion in global markets, driven by escalating geopolitical tensions in the Middle East."
2026-03-11,82018a32bc69,FXStreet,https://www.fxstreet.com/news/gbp-usd-steadies-near-134-despite-oil-shock-hot-us-inflation-202603111603,USD,"GBP/USD steadies near 1.34 despite Oil shock, hot US inflation","The Pound Sterling (GBP) remains firm during the North American session on Wednesday, even though the Middle East conflict entered its twelfth day of hostilities. Inflation in the US boosted the Greenback’s prospects, yet GBP/USD trades at around 1.3400, virtually unchanged."
2026-03-11,245a61e5ef49,FXStreet,https://www.fxstreet.com/news/gold-stalls-below-5-200-as-markets-brace-for-us-inflation-data-202603111159,USD,"Gold struggles below $5,200 as firmer US Dollar and higher yields weigh","Gold (XAU/USD) trades with a mild downside bias on Wednesday, failing to build on the previous day’s gains as the US Dollar (USD) extends its intraday advance and Treasury yields edge higher after US inflation data came in broadly in line with expectations."
2026-03-11,ba2e398763c2,FXStreet,https://www.fxstreet.com/news/aud-rba-signals-support-recovery-prospects-ocbc-202603111444,USD,AUD: RBA signals support recovery prospects – OCBC,"OCBC strategists Christopher Wong and Sim Moh Siong note the Australian Dollar outperformed as global risk sentiment improved and the Reserve Bank of Australia turned more hawkish. OIS pricing now assigns a higher probability to a March rate hike, though OCBC still expects the next move in May."
2026-03-11,a0b7b5dc7cb2,FXStreet,https://www.fxstreet.com/news/us-president-trump-iran-war-will-end-soon-202603111417,USD,US President Trump: Iran war will end soon,United States (US) President Donald Trump said that the war with Iran will end soon because there is practically nothing left to target in a brief phone call with Axios on Wednesday.
