date,article_id,source,url,currency,title,snippet
2026-03-05,d2b9b78652a6,FXStreet,https://www.fxstreet.com/news/eur-gbp-steadies-near-08700-ahead-of-eurozone-retail-sales-data-202603050906,EUR,EUR/GBP steadies near 0.8700 ahead of Eurozone Retail Sales data,"EUR/GBP moves sideways after registering gains in the previous session, trading around 0.8700 during the Asian hours on Thursday. The currency cross remains subdued ahead of the Eurozone Retail Sales data release later in the day."
2026-03-05,e335828ecbda,FXStreet,https://www.fxstreet.com/news/eurozone-gas-shock-challenges-ecb-path-bny-202603050853,EUR,Eurozone: Gas shock challenges ECB path – BNY,BNY strategist Geoff Yu argues that the sharp repricing of European natural gas futures has significantly overshot assumptions embedded in recent ECB staff projections.
2026-03-05,747bcae3272d,FXStreet,https://www.fxstreet.com/news/japanese-yen-turns-upside-down-against-us-dollar-as-dovish-fed-bets-recede-202603050845,EUR,Japanese Yen turns upside down against US Dollar as dovish Fed bets recede,The Japanese Yen (JPY) gives back its early gains and turns negative against the US Dollar (USD) during the European trading session on Thursday. The USD/JPY pair rises to near 157.35 as the US Dollar resumes its upside journey after a corrective move.
2026-03-05,e488e73a2f9a,FXStreet,https://www.fxstreet.com/news/gbp-sterling-outperforms-on-positioning-ing-202603050808,EUR,GBP: Sterling outperforms on positioning – ING,"Chris Turner at ING notes that despite broad Dollar strength, the Pound has outperformed the Euro, with EUR/GBP dropping sharply during a recent deleveraging phase. He attributes this to stretched positioning and reduced expectations for Bank of England easing."
2026-03-05,885c0bde0630,FXStreet,https://www.fxstreet.com/news/usd-cad-price-forecast-hand-holds-20-day-ema-amid-us-iran-war-202603050805,EUR,USD/CAD Price Forecast: Hand holds 20-day EMA amid US-Iran war,The USD/CAD pair trades flat at around 1.3645 during the European trading session on Thursday. The Loonie pair consolidates as the recovery move in the US Dollar (USD) after a slight correction has offset the strength in the Canadian Dollar.
2026-03-05,8ec503916363,FXStreet,https://www.fxstreet.com/news/eur-usd-oil-driven-terms-of-trade-support-dollar-commerzbank-202603050753,EUR,EUR/USD: Oil-driven terms of trade support Dollar – Commerzbank,Commerzbank’s Michael Pfister revisits international trade theory to explain why higher Oil prices and the US status as a net Oil exporter are supportive for the Dollar against the Euro.
2026-03-05,25c42fb1db31,FXStreet,https://www.fxstreet.com/news/aud-usd-price-forecast-trades-around-07050-after-breaking-below-nine-day-ema-202603050741,EUR,AUD/USD Price Forecast: Trades around 0.7050 after breaking below nine-day EMA,"AUD/USD pares its recent gains from the previous session, trading around 0.7050 during the early European hours on Thursday. The technical analysis of the daily chart indicates that the pair is remaining within the ascending channel pattern, indicating that bullish bias prevails."
2026-03-05,1f3f385a2d06,FXStreet,https://www.fxstreet.com/news/ecbs-villeroy-the-duration-of-iran-war-will-determine-impact-on-prices-202603050714,EUR,ECB’s Villeroy: The duration of Iran war will determine impact on prices,"European Central Bank (ECB) Governing Council (GC) member and Bank of France Governor, François Villeroy de Galhau, assures investors that the central bank is closely tracking energy prices and markets amid the war in the Middle East in his comments during European trading hours on Thursday."
2026-03-05,43ca876cd6db,FXStreet,https://www.fxstreet.com/news/new-zealand-dollar-weakens-below-05950-amid-persistent-geopolitical-risks-202603050706,EUR,New Zealand Dollar weakens below 0.5950 amid persistent geopolitical risks,The NZD/USD pair trades in negative territory around 0.5920 during the early European trading hours on Thursday. The New Zealand Dollar (NZD) softens against the Greenback on escalating conflict in the Middle East.
2026-03-05,4751108a400c,FXStreet,https://www.fxstreet.com/news/european-gas-upside-risks-build-on-russian-supply-threat-ing-202603050650,EUR,European gas: Upside risks build on Russian supply threat – ING,"ING’s Warren Patterson and Ewa Manthey warn that European gas faces growing upside risks after President Putin signalled Russia could redirect gas away from the EU, just as global LNG flows from the Persian Gulf are disrupted."
2026-03-05,a6652fdf7805,Yahoo Finance,https://finance.yahoo.com/news/eurodry-edry-reports-profitable-q4-152016059.html,EUR,EuroDry (EDRY) Reports Profitable Q4 with Surging Adjusted EBITDA,
2026-03-05,d0ff2efdaa99,ForexLive,https://investinglive.com/news/australian-trade-balance-highlights-a-light-asia-pacific-calendar-eyes-on-korea-20260304/,AUD,Australian trade balance highlights a light Asia-Pacific calendar. Eyes on Korea,"The Asia-Pacific economic calendar has only one highlight today and that's the Australian January trade balance in goods report. The consensus is a surplus of A$3.9 billion, in a solid improvement from +$3.337 billion in December.Yesterday's price action in AUD was strange as it was a laggard despite the stronger GDP number. I tend to think the drop in gold prices and rout in mining stocks might have discouraged some of the thinking around an investment boom. Naturally, all eyes remain on the Mi"
2026-03-05,dcd7ab5fa541,NewsAPI (The Times of India),https://timesofindia.indiatimes.com/tv/news/hindi/the-50-ridhi-dogra-discusses-her-bond-with-siwet-tomar-with-yuvika-choudhary-says-my-last-2-3-years-were-very-difficult-was-cut-off-/articleshow/128991790.cms,AUD,"The 50: Ridhi Dogra discusses her bond with Siwet Tomar with Yuvika Choudhary; says 'My last 2-3 years were very difficult, was cut off...'","During an intimate conversation on 'The 50', Ridhi Dogra opened up to Yuvika Chaudhary about her experiences with Siwet. Ridhi was taken aback by Siwet's warm gestures, especially after enduring a rough patch marked by solitude. She revealed her wish to embra…"
2026-03-05,8c20aef9585b,NewsAPI (GlobeNewswire),https://www.globenewswire.com/news-release/2026/03/04/3249202/0/en/George-Weston-Limited-Reports-Adjusted-Diluted-Net-Earnings-Per-Common-Share-Growth-of-15-2-in-the-Fourth-Quarter.html,AUD,George Weston Limited Reports Adjusted Diluted Net Earnings Per Common Share Growth of 15.2% in the Fourth Quarter,"TORONTO, March 04, 2026 (GLOBE NEWSWIRE) -- George Weston Limited (TSX: WN) (“GWL” or the “Company”) today announced its consolidated unaudited results for the 13 weeks ended December 31, 2025(2)."
2026-03-05,684349e18066,NewsAPI (Financial Post),https://financialpost.com/globe-newswire/george-weston-limited-reports-adjusted-diluted-net-earnings-per-common-share-growth-of-15-2-in-the-fourth-quarter,AUD,George Weston Limited Reports Adjusted Diluted Net Earnings Per Common Share Growth of 15.2% in the Fourth Quarter,"TORONTO, March 04, 2026 (GLOBE NEWSWIRE) — George Weston Limited (TSX: WN) (“GWL” or the “Company”) today announced its consolidated unaudited results for the 13 weeks ended December 31, 2025(2). GWL’s 2025 Annual Report includes the Company’s audited annual …"
2026-03-06,1885e7aafe6f,NewsAPI (GlobeNewswire),https://www.globenewswire.com/news-release/2026/03/05/3249988/0/en/Verisk-Reiterates-its-Growth-Targets-and-Outlines-Strategy-for-its-Next-Phase-of-Compounding-Growth-at-2026-Investor-Day.html,GBP,Verisk Reiterates its Growth Targets and Outlines Strategy for its Next Phase of Compounding Growth at 2026 Investor Day,"JERSEY CITY, N.J., March 05, 2026 (GLOBE NEWSWIRE) -- Verisk (Nasdaq: VRSK), a leading strategic data analytics and technology partner to the global insurance industry, will host its Investor Day today at 8 a.m. ET, where Verisk President and CEO Lee Shavel, …"
2026-03-06,0f0282cc08b1,Yahoo Finance,https://finance.yahoo.com/news/galaxy-digital-glxy-climbs-17-010224653.html,CAD,"Galaxy Digital (GLXY) Climbs 17.7% on Canada Delisting, Bitcoin Surge",
2026-03-06,8cb10baac4b4,NewsAPI (GlobeNewswire),https://www.globenewswire.com/news-release/2026/03/05/3249855/0/en/Strong-fourth-quarter-results-and-record-high-production.html,NOK,Strong fourth quarter results and record-high production,"(Oslo, Norway, 5 March 2026) – Statkraft delivered strong underlying results in the fourth quarter of 2025, driven by higher Nordic power prices and record-high production. For the full year, production exceeded 70 TWh for the first time, while continued cost…"
2026-03-06,0924fe7682c1,ForexLive,https://investinglive.com/news/china-hopes-to-convince-iran-to-allow-lng-to-pass-through-hormuz-20260306/,CNY,China hopes to convince Iran to allow LNG to pass through Hormuz,"Reuters is reporting that China is in direct talks with Iran to secure safe passage through the Strait of Hormuz for crude and Qatari LNG vessels. They cited three three diplomatic sources who are unnamed.We're on day six of the US-Israeli conflict with Iran and the Strait is effectively closed for business, with about a fifth of global oil and LNG supply bottlenecked. Crude tanker transits collapsed from an average of 24 per day to just four on March 1. Around 300 tankers are sitting inside the"
2026-03-06,850f58986d98,ForexLive,https://investinglive.com/news/japan-finance-minister-says-will-respond-nimbly-to-latest-market-movements-20260306/,USD,Japan finance minister says will respond nimbly to latest market movements,"Japan has not fully exited from deflationCompiling extra budget would of course be an option as said beforeGovernment ready to take steps in a timely manner to combat economic impact from US-Iran conflictMarkets are making big moves so we will respond nimbly while closely communicating with peersWith all the focus on the Middle East, we may get some added volatility from Japan before the week comes to a close. USD/JPY is bordering at the week's highs near the 158.00 level, threatening its highes"
2026-03-06,e7a328111334,ForexLive,https://investinglive.com/news/investinglive-asia-pacific-market-news-wrap-the-mood-improves-modestly-20260306/,USD,investingLive Asia-Pacific market news wrap: The mood improves modestly,"China hopes to convince Iran to allow LNG to pass through HormuzGulf states could review overseas investments - reportFed's Goolsbee: Institutions are facing a crisis of trustUS admiral: Iran's ballistic missile attacks have decreased by 90%Trump says Iran is contacting them seeking guidance on negotiating a dealCostco beats on earnings but little reaction from sharesMarkets:Gold up $57 to $5133WTI crude oil down 96-cents to $80.04AUD leads, USD lagsNikkei up 0.5%US 10-year yields down 1.2 bps t"
2026-03-06,c6442d2fb1ff,ForexLive,https://investinglive.com/news/australian-dollar-climbs-as-a-positive-risk-mood-leads-to-us-dollar-selling-20260306/,USD,Australian dollar climbs as a positive risk mood leads to US dollar selling,"The mood is improving in Asia.The steady selling of risk assets and flight to the US dollar has given way to some optimism in Asia and that's reflected in decent bids in the Australian dollar and broad USD weakness. That's come with some oil selling as the US floats more measures to stop the runaway rise in crude prices.Notably, gold remains strongly bid as it has all week in Asia-Pacific hours. It just hit a session high, up $31 to $51.06. S&P 500 futures are fractionally higher but the Nikkei'"
2026-03-06,4f3df5eab6b6,ForexLive,https://investinglive.com/news/us-import-prices-for-january-02-vs-02-expected-export-prices-06-vs-03-expected-20260305/,USD,US import prices for January 0.2% vs. 0.2% expected. Export prices 0.6% vs 0.3% expected,Import Prices:Prior month import prices 0.1% revised higher to 0.2%Import prices MoM for January 0.2% vs 0.2% expectedImport Prices YoY x.x% vs 0.0% last monthExport Prices:Prior month export prices 0.3% revised higher to 0.6%Export prices MoM 0.6% vs 0.3%.The U.S. Import and Export Price Indexes are released monthly by the Bureau of Labor Statistics (BLS) and measure how prices are changing for goods and services traded between the United States and the rest of the world.Import prices track the
2026-03-06,08b52f5e94e5,FXStreet,https://www.fxstreet.com/news/usd-upside-risks-build-on-data-and-geopolitics-ocbc-202603061140,USD,USD: Upside risks build on data and geopolitics – OCBC,OCBC strategists Sim Moh Siong and Christopher Wong highlight that recent US labour data and escalating Middle East tensions are supporting the Dollar.
2026-03-06,288f10dd6cb3,FXStreet,https://www.fxstreet.com/news/usd-nfp-test-for-labor-resilience-bbh-202603061106,USD,USD: NFP test for labor resilience – BBH,Brown Brothers Harriman’s (BBH) Elias Haddad notes that the February NFP report will be crucial for assessing whether the US labor market is genuinely strengthening or if January’s strong gains were a one-off.
2026-03-06,5fad0a1458e4,FXStreet,https://www.fxstreet.com/news/us-nonfarm-payrolls-set-to-grow-at-moderate-pace-in-february-after-stellar-january-202603060500,USD,US Nonfarm Payrolls set to show moderate job growth as traders pare Fed rate cut bets,The United States (US) Bureau of Labor Statistics (BLS) will release the Nonfarm Payrolls (NFP) data for February at 13:30 GMT.
2026-03-06,a4bf322bb31a,FXStreet,https://www.fxstreet.com/news/qatars-kaabi-oil-prices-could-surge-to-150-a-barrel-ft-202603061008,USD,Qatar’s Kaabi: Oil prices could surge to $150 a barrel - FT,"Qatar’s Energy Minister Saad al-Kaabi said in an interview with the Financial Times (FT) published on Friday that all Gulf energy producers to shut ​down exports within weeks amid the ongoing war in the Middle East, which involves the United States (US), Israel, and Iran."
2026-03-06,9feac47a5aa4,FXStreet,https://www.fxstreet.com/news/usd-inr-drops-at-open-outlook-remains-firm-amid-higher-oil-prices-fiis-selling-202603060533,USD,USD/INR trades cautiously ahead of US NFP data,The Indian Rupee (INR) trades higher against the US Dollar (USD) during afternoon trading hours in India on Friday.
2026-03-06,a5d95b838f0b,FXStreet,https://www.fxstreet.com/news/silver-price-today-silver-rises-according-to-fxstreet-data-202603060930,USD,"Silver price today: Silver rises, according to FXStreet data","Silver prices (XAG/USD) rose on Friday, according to FXStreet data. Silver trades at $84.20 per troy ounce, up 2.65% from the $82.02 it cost on Thursday."
2026-03-06,b147de8b5811,FXStreet,https://www.fxstreet.com/news/usd-softer-payrolls-expected-deutsche-bank-202603060846,USD,USD: Softer payrolls expected – Deutsche Bank,"Deutsche Bank economists project a slowdown in February Nonfarm Payrolls to 30k from January’s 130k, with the Unemployment Rate steady at 4.3%."
2026-03-06,def6fff468c7,FXStreet,https://www.fxstreet.com/news/gold-advances-but-remains-on-track-for-weekly-decline-202603060353,USD,Gold remains stronger as US Dollar holds losses despite Fed cautious tone,Gold price (XAU/USD) recovers its recent losses from the previous session on Friday.
2026-03-06,6c950d051b48,FXStreet,https://www.fxstreet.com/news/usd-jobs-data-and-yields-in-focus-danske-bank-202603060737,USD,USD: Jobs data and yields in focus – Danske Bank,"Danske Research Team highlights that the key release is the US February jobs report, where they expect Nonfarm Payrolls to slow to 70k and unemployment to hold at 4.3%. Weekly jobless claims remain low and layoffs are easing, while productivity has cooled and unit labour costs have risen."
2026-03-06,db0d500d2405,FXStreet,https://www.fxstreet.com/news/usd-limited-impact-from-jobs-data-commerzbank-202603060630,USD,USD: Limited impact from jobs data – Commerzbank,Commerzbank’s Volkmar Baur argues that the upcoming US labour market report is unlikely to shift expectations for Federal Reserve policy or materially reprice the Dollar.
2026-03-06,33e5abcfef67,NewsAPI (BusinessLine),https://www.thehindubusinessline.com/markets/forex/rupee-rebounds-from-lowest-level-to-settle-45-paise-higher-at-9160-per/article70707005.ece,USD,Rupee rebounds from lowest level to settle 45 paise higher at 91.60 per $,The rupee rebounded from its lowest level and settled with a gain of 45 paise at 91.60 (provisional) against US dollar on Thursday on the back of a buying trend in domestic equity markets and reports of Reserve Bank intervention.
2026-03-06,98e51ddf94eb,NewsAPI (newsBTC),http://www.newsbtc.com/analysis/solana-sol-rally-builds-95/,USD,"Solana (SOL) Rally Builds, Traders Watch Critical $100 Test",Solana started a fresh increase above the $88 zone. SOL price is now consolidating above $90 and might aim for more gains above the $95 zone. SOL price started a fresh upward move above the $85 and $88 levels against the US Dollar. The price is now trading ab…
2026-03-06,2a28a7a87715,NewsAPI (BusinessLine),https://www.thehindubusinessline.com/markets/forex/rupee-rebounds-from-all-time-low-gains-48-paise-to-9157-against-us-dollar-in-early-trade/article70705983.ece,USD,"Rupee rebounds from all-time low, gains 48 paise to 91.57 against US dollar in early trade","Higher crude oil prices, a strengthening American currency and intense selling of Indian equities by foreign investors amid escalating tension in West Asia keep rupee under pressure"
2026-03-06,a73b054f586e,NewsAPI (The Times of India),https://economictimes.indiatimes.com/markets/forex/forex-news/rupee-rebounds-from-all-time-low-gains-48-paise-to-91-57-against-us-dollar-in-early-trade/articleshow/129068299.cms,USD,"Rupee rebounds from all-time low, gains 48 paise to 91.57 against US dollar in early trade","The Indian Rupee has recovered from its record low, gaining 48 paise to trade at 91.57 against the US dollar. This recovery follows positive momentum in domestic equity markets. However, rising crude oil prices and foreign investor selling continue to exert p…"
2026-03-06,56ea39ea80a5,NewsAPI (CNA),https://www.channelnewsasia.com/business/revolut-files-us-bank-charter-names-duransoy-us-ceo-5973836,USD,"Revolut files for US bank charter, names Duransoy as US CEO","NEW YORK, March 5 : Britain's Revolut applied for a U.S. bank charter and appointed former Visa executive Cetin Duransoy as its new CEO for the United States, the fintech company announced on Thursday. Revolut, which has about 70 million clients in 40 markets…"
2026-03-06,c940233423ec,NewsAPI (Financial Post),https://financialpost.com/pmn/business-pmn/traders-turn-to-canadas-dollar-as-iran-war-risks-jolt-market,USD,Traders Turn to Canada’s Dollar As Iran War Risks Jolt Market,The Canadian dollar has become a top pick in the $9.5-trillion-a-day foreign exchange market due to its link to oil prices as the war in the Middle East grinds on.
2026-03-06,f65796fbf3db,NewsAPI (CoinDesk),https://www.coindesk.com/policy/2026/03/05/zerohash-applies-for-national-trust-bank-charter-to-expand-regulated-stablecoin-services,USD,ZeroHash applies for national trust bank charter to expand regulated stablecoin services,"The charter would allow ZeroHash to operate under a single federal framework, rather than state-by-state rules, and offer services aligned with recent legislation."
2026-03-06,33151a2feb71,NewsAPI (Bitcoinist),https://bitcoinist.com/kraken-first-crypto-firm-access-fed-master-accounts/,USD,Kraken Becomes First Crypto Firm To Gain Access To Federal Reserve’s Master Accounts – Report,"Kraken, the US’s second-largest crypto exchange, has reportedly secured access to the Federal Reserve’s (Fed) core payment systems, marking a significant milestone as the first crypto firm to operate on the same infrastructure utilized by thousands of banks a…"
2026-03-06,431044a372be,Yahoo Finance,https://finance.yahoo.com/news/crypto-scores-first-direct-access-003700188.html,USD,Crypto scores first direct access to Fed payment system,
2026-03-06,bdf224ba769e,NewsAPI (GlobeNewswire),https://www.globenewswire.com/news-release/2026/03/05/3249978/0/en/LINK-FOREX-Research-Head-David-Whitcombe-Quietly-Funds-Measles-Patients-in-Mexico.html,MXN,LINK FOREX Research Head David Whitcombe Quietly Funds Measles Patients in Mexico,"London, United Kingdom, March 05, 2026 (GLOBE NEWSWIRE) -- Amid a recent surge in measles cases in parts of Mexico, some families are facing the dual pressures of strained healthcare resources and rising treatment costs. For some low-income families, continue…"
2026-03-06,5daf8ad5de13,NewsAPI (Financial Post),https://financialpost.com/pmn/business-wire-news-releases-pmn/pan-american-silver-discovers-new-high-grade-veins-at-the-la-colorada-mine,MXN,Pan American Silver Discovers New High-Grade Veins at the La Colorada Mine,"VANCOUVER, British Columbia — Pan American Silver Corp. (NYSE: PAAS) (TSX: PAAS) (“Pan American” or the “Company”) reports new drill results from the southeastern and eastern Candelaria zones of the La Colorada mine in Zacatecas, Mexico. Exploration drilling …"
2026-03-06,5d82acc056b4,ForexLive,https://investinglive.com/news/oil-prices-resume-climb-to-start-european-morning-trade-20260306/,EUR,Oil prices resume climb to start European morning trade,"We're starting to see oil prices approach the highs from yesterday and most notably, WTI crude oil is wanting to hold above the crucial $80 mark. Despite all the volatility and a couple of downside spikes here and there, it's been an otherwise one-sided push higher mostly for oil prices all through this week.Right now, we're seeing WTI crude oil be up 0.7% on the day to $81.70 while Brent crude oil is up 0.6% near the $86 mark. All of this will just continue to reinvigorate talks of prices poten"
2026-03-06,3af66c9c3ff4,ForexLive,https://investinglive.com/news/what-are-the-main-events-for-today-20260306/,EUR,What are the main events for today?,"EUROPEAN SESSIONIn the European session, we don't have much on the agenda other than the final Eurozone Q4 GDP report. This is very old data by now, so the market reaction will be muted. In fact, we are almost at the end of Q1 2026 and what happens next with the US-Iran war will shape the future data. That's why the focus is on the war.AMERICAN SESSIONIn the American session, the main highlight is going to be the US NFP report. We also get the January US Retail Sales, but that's old and volatile"
2026-03-06,172b76706d19,ForexLive,https://investinglive.com/news/investinglive-americas-fx-news-wrap-5-mar-geopolitics-continue-to-drive-the-markets-20260305/,EUR,investingLive Americas FX news wrap 5 Mar: Geopolitics continue to drive the markets,US stocks close lower but rebound into the closeCrude oil settles at $6.35 higher or 8.51% at $81.01Kristi Noem is replaced as Homeland Security Secretary.Pres. Trump not looking to tap into the strategic petroleum reserve (SPR)European indices close sharply lower after reversing earlier gainsOil jumps above $78 helped by reported attack on Bahrain facilityEnergy and tech sectors drive mixed market movementsMarket Update: Gold reverses gains amid central-bank selling chatterFeds Barkin: Recent i
2026-03-06,5060a885927d,ForexLive,https://investinglive.com/news/investinglive-european-markets-wrap-caution-holds-as-focus-stays-on-us-iran-conflict-20260305/,EUR,investingLive European markets wrap: Caution holds as focus stays on US-Iran conflict,Headlines:Iran is ready to abandon its nuclear program if the US makes a satisfactory offerIs this a hint that the US-Iran conflict might stretch on for much longer?ECB's de Guindos: Baseline scenario is that US-Iran will be a short conflictECB policymaker Villeroy: I do not see reason today why we should raise interest ratesEurozone January retail sales -0.1% vs +0.3% m/m expectedGermany February construction PMI 43.7 vs 44.7 priorUK February construction PMI 44.5 vs 47.0 expectedUS February Ch
2026-03-06,e63584924c35,FXStreet,https://www.fxstreet.com/news/silver-price-forecast-xag-usd-trades-broadly-flat-around-8280-as-investors-await-us-nfp-202603061127,EUR,Silver Price Forecast: XAG/USD trades broadly flat around $82.80 as investors await US NFP,"Silver price (XAG/USD) trades broadly sideways around $82.80 during the European trading session on Friday. The white metal consolidates as investors await the United States (US) Nonfarm Payrolls (NFP) data for February, which will be published at 13:30 GMT."
2026-03-06,6570a495f0b4,FXStreet,https://www.fxstreet.com/news/eur-gbp-dips-as-eurozone-growth-slows-boe-rate-cut-odds-drop-202603061116,EUR,"EUR/GBP dips as Eurozone growth slows, BoE rate cut odds drop","EUR/GBP trades around 0.8680 on Friday at the time of writing, losing 0.10% on the day as investors assess contrasting economic outlooks in the Eurozone and the United Kingdom (UK)."
2026-03-06,6cfb4c75170e,FXStreet,https://www.fxstreet.com/news/wti-rallies-as-qatars-kaabi-expects-oil-price-to-surge-to-150-barrel-amid-iran-conflicts-202603061040,EUR,WTI rallies as Qatar’s Kaabi expects oil price to surge to $150/barrel amid Iran conflicts,"West Texas Intermediate (WTI), futures on NYMEX, surges to near $82.80 during the European trading session on Friday, the highest level seen since July 2024."
2026-03-06,959030717bdd,FXStreet,https://www.fxstreet.com/news/ecbs-escriva-its-very-unlikely-that-we-will-touch-rates-at-the-next-meeting-202603061000,EUR,ECB’s Escriva: It's very unlikely that we will touch rates at the next meeting,"In an interview with the regional Catalan TV3 television on Friday, European Central Bank (ECB) policymaker Jose Luis Escriva commented on the monetary policy outlook in the face of the ongoing Middle East conflict."
